"role_id","name","description"
"Consumer","Consumer","A natural person who is a California resident whose personal information is collected or processed by a business."
"Business","Business","An entity that collects personal information from California residents and determines the purposes and means of processing."
"Service Provider","Service Provider","An entity that processes personal information on behalf of a business under a contract that restricts its use."
"Contractor","Contractor","A person to whom a business makes available a consumer's personal information for a business purpose."
"Third Party","Third Party","Any natural or legal person, public authority, agency or body other than the data subject, controller, processor and persons who under the direct authority of the controller or processor are authorized to process data."
"CPPA","California Privacy Protection Agency","State agency responsible for enforcing CPRA and establishing and publishing regulations."
"Attorney General","California Attorney General","Responsible for enforcing CPRA and protecting consumer privacy rights."
