chapter_id,chapter_number,title,description
CH-01,I,Preliminary,Introduction and definitions
CH-02,II,Data Fiduciary,Fiduciary obligations and responsibilities
CH-03,III,Data Principal Rights,Rights of data principals
CH-04,IV,Significant Data Fiduciaries,Obligations of significant fiduciaries
CH-05,V,Data Processors,Processor roles and obligations
CH-06,VI,Data Protection Impact Assessment,Assessment requirements
CH-07,VII,Children and Vulnerable Persons,Special protections
CH-08,VIII,Exemptions and Restricted Processing,Legal exemptions
CH-09,IX,Penalties and Enforcement,Penalties and enforcement mechanisms
