rule_id,name,cfr_citation,cfr_parts,description,long_description,type,rule_category,enacted_date,effective_date,last_amended_date,applicable_entities,primary_requirements,authorization_required,minimum_necessary_applies,documentation_required,audit_required,encryption_required,audit_logging_required,risk_assessment_frequency,enforcement_authority,url,reference_url,industry_standard_regulation_id,status,compliance_complexity,severity_rating
HIPAA_PRIVACY_RULE,"Privacy Rule","45 CFR ยง164.500-534","45 CFR Part 160; 45 CFR Part 164","Controls use and disclosure of Protected Health Information","The Privacy Rule establishes national standards to protect patient health information privacy. It defines permitted and non-permitted uses and disclosures of PHI, grants individuals rights to access and amend their health information, and sets requirements for covered entities and business associates.","Privacy","Regulatory","1996-08-21","2003-04-14","2013-01-25","Covered Entities; Business Associates; Subcontractors","Use and Disclosure Controls; Individual Rights; Minimum Necessary Standard; Authorization Requirements; Privacy Safeguards; Workforce Training","false","true","true","false","false","false","N/A","HHS Office for Civil Rights (OCR)","https://www.hhs.gov/hipaa/for-professionals/privacy/index.html","https://www.ecfr.gov/current/title-45/part-164/subpart-e","HIPAA 1996","Active","High","Very High"
HIPAA_SECURITY_RULE,"Security Rule","45 CFR ยง164.302-318","45 CFR Part 160; 45 CFR Part 164","Requires administrative, physical, and technical safeguards for Electronic Protected Health Information","The Security Rule establishes national standards and procedures for protecting Electronic PHI (ePHI). It requires covered entities and business associates to implement administrative, physical, and technical safeguards to ensure confidentiality, integrity, and availability of ePHI. The rule includes specific requirements for risk assessment, access controls, encryption, audit controls, and incident response.","Security","Regulatory","1996-08-21","2005-04-20","2013-01-25","Covered Entities; Business Associates; Subcontractors","Risk Assessment and Management; Administrative Safeguards; Physical Safeguards; Technical Safeguards; Workforce Security; Access Controls; Encryption; Audit Logging; Incident Response; Contingency Planning","false","true","true","true","true","true","Annual","HHS Office for Civil Rights (OCR)","https://www.hhs.gov/hipaa/for-professionals/security/index.html","https://www.ecfr.gov/current/title-45/part-164/subpart-c","HIPAA 1996","Active","Very High","Very High"
HIPAA_BREACH_NOTIFICATION_RULE,"Breach Notification Rule","45 CFR ยง164.400-414","45 CFR Part 160; 45 CFR Part 164","Establishes procedures for notifying individuals when their Protected Health Information is compromised","The Breach Notification Rule requires covered entities and business associates to notify individuals when unsecured PHI is acquired by unauthorized persons. The rule defines what constitutes a breach, requires risk assessment to determine if breach notification is necessary, and specifies notification procedures, timelines, and content requirements for notifications to individuals, media, and the Department of Health and Human Services.","Breach Notification","Regulatory","2009-02-18","2009-02-18","2013-01-25","Covered Entities; Business Associates","Breach Detection and Assessment; Risk Assessment; Notification to Individuals; Notification to Media; Notification to HHS; Mitigation Services; Documentation","false","false","true","false","false","false","60 days max","HHS Office for Civil Rights (OCR)","https://www.hhs.gov/hipaa/for-professionals/breach-notification/index.html","https://www.ecfr.gov/current/title-45/part-164/subpart-d","HIPAA 1996","Active","High","Very High"
HIPAA_ADMINISTRATIVE_SIMPLIFICATION_RULE,"Administrative Simplification Rule","45 CFR Part 160, Part 162","45 CFR Part 160; 45 CFR Part 162; 45 CFR Part 164","Establishes standards for electronic healthcare transactions and code sets","The Administrative Simplification provisions establish national standards for electronic healthcare transactions, code sets, identifiers, and operating rules. These standards promote electronic exchange of health information and improve administrative efficiency. Includes standards for transactions such as claims, eligibility inquiry and response, referral authorization and inquiry, and electronic funds transfer.","Administrative Simplification","Regulatory","1996-08-21","2005-10-16","2015-01-10","Covered Entities; Business Associates","Electronic Transaction Standards; Code Set Standards; Identifier Standards; Operating Rules Compliance","false","false","true","false","false","false","As needed","HHS Office for Civil Rights (OCR)","https://www.hhs.gov/hipaa/for-professionals/transactions-codes-identifiers/index.html","https://www.ecfr.gov/current/title-45/part-162","HIPAA 1996","Active","High","High"
HIPAA_ENFORCEMENT_RULE,"HIPAA Enforcement Rule","45 CFR Part 160","45 CFR Part 160","Establishes procedures for investigation and enforcement of HIPAA violations","The Enforcement Rule establishes procedures for HHS Office for Civil Rights (OCR) to investigate HIPAA violations, assess civil penalties, and take enforcement actions. It defines violation categories, penalty tiers, and procedures for entities to resolve violations through corrective action plans. The rule provides appeal rights and establishes minimum penalties for willful neglect.","Enforcement","Regulatory","1996-08-21","2006-03-16","2013-01-25","Covered Entities; Business Associates","Violation Investigation; Civil Penalty Assessment; Corrective Action Plans; Compliance Reporting","false","false","true","false","false","false","Per violation","HHS Office for Civil Rights (OCR)","https://www.hhs.gov/hipaa/for-professionals/compliance-enforcement/index.html","https://www.ecfr.gov/current/title-45/part-160","HIPAA 1996","Active","High","Very High"
