request_id,request_type,description,response_timeline,fees_allowed,cfr_citation,framework_version,old_request_id,status
PR-001-v2,Access Request,Request for access to own PHI,30-60 days,Reasonable copying fees,45 CFR 164.524,HIPAA_2026_v2,PR-001,Active
PR-002-v2,Amendment Request,Request to amend PHI,30-60 days,No fees,45 CFR 164.526,HIPAA_2026_v2,PR-002,Active
PR-003-v2,Accounting Request,Request for accounting of disclosures,30-60 days,First free/1 per year,45 CFR 164.528,HIPAA_2026_v2,PR-003,Active
PR-004-v2,Communication Request,Request for confidential communications,30-60 days,No fees,45 CFR 164.522,HIPAA_2026_v2,PR-004,Active
PR-005-v2,Restriction Request,Request to restrict use/disclosure,Accept/deny required,No fees,45 CFR 164.522(a),HIPAA_2026_v2,PR-005,Active
PR-006-v2,Breach Notification Request,Request for notification of breach,Without unreasonable delay,No fees,45 CFR 164.400,HIPAA_2026_v2,PR-006,Active
PR-007-v2,Complaint Filing,Request to file privacy complaint,Anytime,No fees,45 CFR 160.306,HIPAA_2026_v2,PR-007,Active