criterion_id,criterion_category,criterion_name,stage,program_id,program_name,criterion_type,description,regulatory_basis,applicable_entities,measurement_approach,threshold_percentage,core_requirement,optional_requirement,clinical_objective,administrative_objective,interoperability_objective,ehr_functionality_required,data_elements_involved,implementation_timeline,documentation_requirements,reporting_requirements,compliance_verification,audit_procedures,success_metrics,failure_consequences,related_measures,priority_level,status
MU1-CPOE,Clinical Functionality,Computerized Provider Order Entry,Stage 1,EHR-MEDICARE,Medicare EHR Incentive Program,Core Measure,Implement and use computerized provider order entry (CPOE) for medication orders; CPOE must be integrated with EHR system; includes verification of all medication orders entered electronically; drug interaction checks performed at order entry; orders must be transmitted electronically to pharmacy; supports reduction in medication errors and adverse drug events; enables real-time clinical decision support,HITECH Section 3001; 45 CFR 170.302; 42 CFR 412.24 (Hospital Quality Reporting); CMS Meaningful Use Definition Rule,Hospitals; Critical Access Hospitals (CAHs); Eligible Professionals (EPs); Group practices; Healthcare systems; Clinics,Percentage of medication orders entered through CPOE divided by total medication orders; Medication order submission logs; EHR system audit trails; Pharmacy connectivity verification; Drug interaction check documentation,>=60% of medication orders (Stage 1); >=70% (Stage 2); >=80% (Stage 3),Yes - Core measure for all providers,No - required in all stages,Reduce medication errors; Improve medication safety; Decrease adverse drug events; Enable clinical decision support at point of order,Establish CPOE governance; Implement staff training; Maintain system documentation; Monitor CPOE utilization; Track error reduction,Electronic transmission to pharmacies; Standardized medication order format; Interoperable drug databases; Lab result integration for medication safety,CPOE module; Drug interaction checking engine; Pharmacy connectivity; Order management system; Clinical decision support integration; Audit logging; Role-based access control,Medication names; Dose; Route; Frequency; Indication; Drug allergies; Existing medications; Drug-drug interactions; Lab values relevant to medication; Prescriber identification; Timestamp,2011 Q1-Q2 for initial deployment; 2011 Q3-Q4 for stage 1 compliance; Continuous optimization 2012,CPOE implementation plan; Workflow documentation; Staff training records (all clinical staff); System configuration specifications; Drug database update logs; Pharmacy connectivity test results; CPOE performance metrics; Error rate documentation; Clinical outcome data,Quarterly meaningful use reporting; Monthly CPOE utilization percentages; Medication error tracking; Drug interaction alert effectiveness; Pharmacy connectivity test results; Staff competency assessments,CMS/State audit of CPOE functionality; Verification of medication order percentages; Review of workflow processes; Pharmacy system connectivity testing; Clinical staff interviews; Patient chart audits (sample of medication orders); Medication error analysis,Targeted audits for CPOE implementation; Random chart audits (50-100 charts); System functionality testing; Workflow observation; Staff competency verification; Comparative analysis with peer organizations; Drug interaction alert testing,CPOE adoption rate; Medication order volume via CPOE; Medication error reduction percentage; Adverse drug event reduction; Pharmacy transmission success rate; Staff competency scores; Patient safety improvements; Clinical decision support utilization,Non-compliance: Loss of incentive payment; Negative payment adjustment beginning 2015; Potential loss of recognition in quality programs; Audit findings; Possible state health department investigation; Loss of meaningful use attestation,MU1-Drug Interaction Checking; MU2-CPOE; MU3-CPOE; Promoting Interoperability CPOE measures; Hospital Quality Reporting System measures,Critical,Active
MU1-E-PRESCRIBE,Clinical Functionality,Electronic Prescribing,Stage 1,EHR-MEDICARE,Medicare EHR Incentive Program,Core Measure,Issue at least one electronic prescription (e-prescription) for eligible medications; prescriptions transmitted electronically to pharmacy; includes capability to check for drug interactions; supports medication adherence through electronic transmission; reduces prescription errors and illegible prescriptions; enables pharmacy verification; part of meaningful use safety objectives,HITECH Section 3001; 45 CFR 170.302; Electronic Prescriptions for Controlled Substances (EPCS) Rule; CMS Meaningful Use Definition Rule; DEA regulation 21 CFR 1300-1312,Eligible Professionals (EPs); Dentists; Optometrists; Pediatricians; Family medicine practitioners; Internists; Group practices; Healthcare systems; Pharmacies (recipients),Percentage of prescriptions issued electronically divided by total prescriptions issued; Prescription transmission logs; Pharmacy delivery confirmation; E-prescription platform documentation; Controlled substance prescription handling,>=40% of prescriptions (Stage 1); >=50% (Stage 2); >=60% (Stage 3),Yes - Core measure for EPs and dentists,No - part of core requirements,Reduce prescription errors; Improve patient medication safety; Ensure legible prescriptions; Support medication adherence; Enable real-time pharmacy communication; Reduce prescription fraud,Establish e-prescribing workflow; Implement staff training on e-prescribing; Maintain system configuration; Monitor compliance rates; Document controlled substance procedures; Handle non-e-prescribable medications (controlled substances initially excluded),Standardized prescription format; Pharmacy integration; Controlled substance e-prescription capability; Prescription transmission verification; Pharmacy acknowledgment; Real-time insurance verification; Drug formulary checking,E-prescribing module; Pharmacy connectivity; Prescription transmission system; Controlled substance management (if applicable); Pharmacy network integration; Digital signature capability (for controlled substances); Audit logging,Medication name; Dose; Route; Frequency; Quantity; Refills; Patient demographics; Prescriber information; Pharmacy information; Drug allergy alerts; Insurance information; Timestamp; Authorization codes (for controlled substances),2011 Q1-Q2 for e-prescribing platform selection; 2011 Q3-Q4 for stage 1 implementation; 2012+ for controlled substance e-prescribing,E-prescribing system configuration; Pharmacy partnership agreements; Staff training materials and records; Prescription transmission test results; Workflow documentation; Controlled substance procedure documentation; Compliance tracking methodology,Monthly e-prescription submission percentage; Pharmacy transmission success rate; Non-e-prescribable medication tracking; Staff competency assessments; Patient feedback on e-prescriptions; Prescription error rate tracking; Insurance verification success rate,CMS/State audit of e-prescribing capability; Verification of prescription percentages; Pharmacy connectivity testing; Workflow process review; Staff interviews; Patient chart audits (sample of prescriptions); Controlled substance documentation review; Error analysis,Targeted audits of high e-prescribing providers; Random chart audits (100+ prescriptions); Pharmacy transmission testing; Workflow observation; Staff competency verification; Non-e-prescribable medication tracking; Controlled substance compliance verification,E-prescription adoption rate; Prescription transmission volume; Prescription error reduction; Patient medication adherence improvement; Pharmacy transmission success rate; Controlled substance compliance; Staff competency; Insurance verification success,Non-compliance: Loss of incentive eligibility; Negative payment adjustment; Audit findings; Potential state health department investigation; Loss of meaningful use certification; Risk of DEA enforcement (if controlled substances mishandled),MU1-Drug Interaction Checking; MU2-E-Prescribe; MU3-E-Prescribe; Hospital Quality Reporting (for facilities); Promoting Interoperability e-prescribing measures,Critical,Active
MU1-LAB-INTEGRATION,Clinical Data Management,Lab Result Integration,Stage 1,EHR-MEDICARE,Medicare EHR Incentive Program,Core Measure,Receive and incorporate lab results into EHR; lab results must be viewable in structured format; must include test name; test result; reference range; unit of measure; date result received; ordering provider information; includes capability to view lab data over time; supports clinical decision-making; facilitates identification of abnormal results,HITECH Section 3001; 45 CFR 170.302; CMS Meaningful Use Definition Rule; Laboratory Standards of Care (CLIA regulations); Continuity of Care Document (CCD) Standards,Hospitals; Critical Access Hospitals; Eligible Professionals; Healthcare systems; Group practices; Laboratories (as data sources); EHR vendors,Percentage of patients with lab results incorporated into EHR divided by total unique patients seen in reporting period; Lab result receipt logs; EHR documentation showing lab result viewing; Electronic result transmission records; Data integrity verification,>=40% of unique patients with lab results (Stage 1); >=50% (Stage 2); >=80% (Stage 3),Yes - Core measure,No - required in all stages,Enable clinical decision-making based on lab data; Facilitate disease monitoring; Improve clinical outcomes; Support diagnosis and treatment decisions; Reduce duplicate testing; Enable comparative analysis of results over time,Establish laboratory partnerships; Configure EHR to receive lab results; Implement staff training on lab data interpretation; Maintain system documentation; Track lab result incorporation rates; Verify lab data quality; Implement data validation procedures,Structured lab data exchange; Standardized lab terminology (LOINC codes); Lab result format standards; Real-time or near-real-time transmission; Exception handling for abnormal results; Audit trails for lab data access,Lab result receiving module; HL7 v2/FHIR interface for lab data; Lab result viewing and graphing tools; Abnormal result flags; Historical trending functionality; Data validation algorithms; Audit logging,Test name (LOINC code); Test result value; Reference range; Unit of measure; Date result received; Lab name and ID; Ordering provider; Patient demographics; Specimen information; Timestamp,2011 Q1-Q2 for lab connectivity planning; 2011 Q3-Q4 for stage 1 lab integration; Ongoing lab partnership expansion,Lab integration plan and timelines; Laboratory partnership agreements; EHR configuration specifications; Staff training documentation; HL7/FHIR interface specifications; Lab data quality procedures; Data validation scripts; Error handling documentation,Quarterly lab result receipt percentage; Monthly volume of incorporated lab results; Data accuracy and completeness metrics; Lab result viewing frequency; User adoption statistics; Exception handling effectiveness,CMS/State audit of lab result capability; Verification of patient percentages with lab data; Lab connectivity testing; Review of lab data quality; Staff interviews on lab data utilization; Patient chart audits (100+ charts); Historical trend verification; Data validation testing,Targeted audits of lab integration effectiveness; Random chart audits with lab result focus; Lab connectivity and data quality testing; Staff workflow observation; Data validation sample testing; Comparative analysis of lab data quality across labs; Exception handling review,Lab result incorporation rate; Lab data accuracy; Lab viewing utilization rate; Clinical decision-making frequency based on lab data; Duplicate test reduction; Efficiency in diagnosis; Patient outcome improvements; Data quality scores,Non-compliance: Loss of incentive payment; Negative payment adjustment; Lab partnership impact on patient care; Audit findings; Potential state health department investigation; Loss of meaningful use certification; Risk of lab compliance issues,MU2-Lab Integration; MU3-Lab Integration; Hospital Quality Reporting lab measures; Promoting Interoperability lab data measures,High,Active
MU1-VITALS-RECORDING,Clinical Data Capture,Vital Signs and BMI Recording,Stage 1,EHR-MEDICARE,Medicare EHR Incentive Program,Core Measure,Record vital signs (blood pressure; heart rate; respiratory rate; temperature; oxygen saturation) and body mass index (BMI) for at least one office visit; vital signs and BMI must be documented in structured data fields; includes automated calculation of BMI from height and weight; vital signs must include date and time of measurement; supports identification of abnormal values; enables trending over time; critical for patient safety and chronic disease management,HITECH Section 3001; 45 CFR 170.302; CMS Meaningful Use Definition Rule; Clinical quality standards for vital signs documentation,Hospitals; Critical Access Hospitals; Eligible Professionals; Group practices; Healthcare systems; Clinics; Ambulatory surgery centers,Percentage of office visits with documented vital signs and BMI divided by total office visits; Vital signs documentation logs; BMI calculation verification; EHR audit trails showing vital signs entry; Staff training documentation,>=80% of office visits with vital signs documented (Stage 1); >=90% (Stage 2); >=100% (Stage 3),Yes - Core measure,No - required in all stages,Identify abnormal vital signs promptly; Support chronic disease monitoring; Enable early detection of health issues; Improve patient safety; Support clinical decision-making; Enable population health monitoring,Implement vital signs workflow in EHR; Train clinical staff on vital signs measurement and documentation; Establish structured data entry fields; Implement automated BMI calculation; Monitor compliance rates; Verify data accuracy; Implement quality checks,Structured vital signs data; Automated BMI calculation; Alert generation for abnormal values; Trending functionality; Point-of-care vital signs device integration; Mobile vital signs entry; Real-time alerts to clinicians,Vital signs documentation module; Point-of-care device interfaces; Automated BMI calculator; Alert system for abnormal ranges; Trending and graphing tools; Mobile/tablet vital signs entry; Data validation rules; Audit logging,Systolic blood pressure; Diastolic blood pressure; Heart rate (beats per minute); Respiratory rate (breaths per minute); Body temperature (Celsius/Fahrenheit); Oxygen saturation percentage; Height (inches/cm); Weight (pounds/kg); BMI (calculated); Measurement timestamp; Clinician name,2011 Q1-Q2 for EHR workflow design; 2011 Q3-Q4 for stage 1 documentation; Continuous monitoring,Vital signs EHR workflow documentation; Staff training curriculum and records; Structured data entry field specifications; Point-of-care device integration guidelines; BMI calculation algorithm; Alert threshold configuration; Data quality procedures; Compliance monitoring methodology,Quarterly vital signs documentation percentage; Monthly volume of visits with vital signs recorded; BMI documentation rate; Abnormal alert effectiveness; Staff competency assessments; Data accuracy verification; Trending functionality utilization,CMS/State audit of vital signs documentation; Verification of office visit percentages; Review of vital signs completeness and accuracy; Patient chart audits (100+ visits); Point-of-care device testing; Staff competency verification; Alert system testing; BMI calculation accuracy testing,Targeted audits of providers with low vital signs documentation; Random chart audits with vital signs focus; Data accuracy and completeness testing; Point-of-care device functionality review; Staff workflow observation; Alert system effectiveness assessment; Trending functionality verification,Vital signs documentation rate; BMI documentation rate; Data accuracy percentage; Abnormal alert response rate; Clinical action taken on abnormal values; Staff competency; Patient safety outcomes; Chronic disease control improvements,Non-compliance: Loss of incentive payment; Potential patient safety impact from missed abnormal values; Audit findings; Negative payment adjustment; Loss of meaningful use certification; Risk of quality score reduction; Patient safety liability,MU2-Vitals; MU3-Vitals; Hospital Quality Reporting vital signs measures; Promoting Interoperability vital signs measures; PQRS quality measures,High,Active
MU1-SMOKING-STATUS,Clinical Data Capture,Smoking Status Recording,Stage 1,EHR-MEDICARE,Medicare EHR Incentive Program,Core Measure,Record smoking status for all patients ages 13 and older at each office visit; smoking status must be documented in structured EHR data field; categories include: current smoker; former smoker; never smoker; unknown status; supports identification of smokers for intervention; critical for preventive health; enables population health analyses; supports chronic disease management in smokers; facilitates smoking cessation counseling,HITECH Section 3001; 45 CFR 170.302; CMS Meaningful Use Definition Rule; Healthy People 2020 smoking cessation objectives; USPSTF smoking cessation recommendations,Hospitals; Critical Access Hospitals; Eligible Professionals; Group practices; Healthcare systems; Clinics; Pediatric practices (if serving patients 13+),Percentage of patients ages 13 and older with documented smoking status divided by total patients ages 13+ seen in reporting period; Smoking status documentation logs; EHR audit trails; Staff training records,>=80% of patients 13+ with smoking status documented (Stage 1); >=90% (Stage 2); >=100% (Stage 3),Yes - Core measure,No - required in all stages,Identify smokers for intervention and counseling; Support smoking cessation programs; Improve chronic disease management; Reduce smoking-related complications; Enable population health monitoring of smoking prevalence; Support preventive health initiatives,Implement smoking status workflow in EHR; Train clinical staff on smoking status assessment; Create structured data entry fields; Establish patient age verification (13+); Monitor compliance rates; Implement data quality checks,Structured smoking status data; Age-appropriate screening; Alert generation for smokers; Documentation of smoking cessation counseling offered; Linkage to smoking cessation resources; Population health analytics capability; Real-time reporting,Smoking status documentation module; Age verification algorithm; Structured dropdown/checkbox for smoking status categories; Alert system for smokers; Counseling documentation module; Smoking cessation resource links; Trending and analytics tools; Audit logging,Smoking status category (current/former/never/unknown); Date status recorded; Age of patient (to verify 13+); Clinician name; Timestamp; Smoking cessation counseling offered (Y/N); Counseling method; Cessation resources provided,2011 Q1-Q2 for EHR workflow setup; 2011 Q3-Q4 for stage 1 implementation; Ongoing monitoring,Smoking status workflow documentation; Staff training curriculum and records; Age verification procedure documentation; Structured data field specifications; Alert configuration; Smoking cessation counseling procedures; Data quality processes; Population health analytics setup,Quarterly smoking status documentation percentage; Monthly smoking prevalence statistics; Smoking cessation counseling rates; Staff competency assessments; Data accuracy verification; Alert effectiveness tracking,CMS/State audit of smoking status documentation; Verification of patient percentages; Review of documentation quality; Patient chart audits (100+ charts); Staff competency verification; Smoking cessation counseling tracking; Alert system testing,Targeted audits of low smoking status documentation; Random chart audits with smoking status focus; Data accuracy testing; Staff workflow observation; Patient age verification review; Smoking cessation counseling documentation review; Trend analysis of smoking prevalence,Smoking status documentation rate; Current smoker identification rate; Smoking cessation counseling effectiveness; Population smoking prevalence tracking; Staff competency; Data accuracy; Preventive health improvements,Non-compliance: Loss of incentive payment; Missed opportunity for smoking cessation intervention; Audit findings; Negative payment adjustment; Loss of meaningful use certification; Risk of quality score reduction; Public health impact,MU2-Smoking Status; MU3-Smoking Status; Hospital Quality Reporting preventive measures; Promoting Interoperability preventive health measures; PQRS preventive care measures,High,Active
MU1-MEDICATION-LIST,Clinical Data Capture,Maintain Active Medication List,Stage 1,EHR-MEDICARE,Medicare EHR Incentive Program,Core Measure,Maintain an active medication list for all patients; medication list must include medication name; dose; route; frequency; documented date; indication; allergy interactions; medication list must be updated at each visit; includes OTC medications when known; supports medication safety; prevents adverse drug interactions; enables pharmacist review; critical for patient safety and care coordination,HITECH Section 3001; 45 CFR 170.302; CMS Meaningful Use Definition Rule; Patient Safety Standards; Medication Safety Best Practices,Hospitals; Critical Access Hospitals; Eligible Professionals; Group practices; Healthcare systems; Clinics; Pharmacies (collaborating entities),Percentage of office visits during reporting period where active medication list was documented divided by total office visits; Medication list documentation logs; EHR audit trails; Medication list completeness checks; Update frequency tracking,>=80% of office visits with active medication list documentation (Stage 1); >=90% (Stage 2); >=100% (Stage 3),Yes - Core measure,No - required in all stages,Prevent medication errors; Enable detection of adverse drug interactions; Support medication safety; Facilitate care coordination; Enable pharmacist medication review; Improve patient compliance; Support chronic disease management; Enable emergency medication information access,Implement medication list workflow in EHR; Train clinical staff on medication list maintenance; Establish update procedures at each visit; Implement OTC medication query process; Monitor list completeness; Verify accuracy of medication data; Implement reconciliation procedures,Structured medication list with all required elements; Update at each visit; OTC medication inclusion; Medication-allergy cross-checking; Interaction alerts; Patient-provided medication lists accepted; Third-party medication list integration; Medication reconciliation capability; Real-time updates,Medication list module; Medication database with drug information; Interaction checking engine; Structured medication entry fields; Allergy cross-reference; OTC medication search; Medication reconciliation tools; Alert system; Audit logging,Medication name (generic/brand); Dose (amount and unit); Route (oral/IV/etc); Frequency (timing); Indication (reason for medication); Start date; Status (active/discontinued); Side effects/allergies; Prescriber information; Pharmacy name; Last update timestamp,2011 Q1-Q2 for medication list workflow design; 2011 Q3-Q4 for stage 1 documentation; Ongoing updates at each visit,Medication list workflow documentation; Staff training curriculum and records; Medication database integration; OTC medication process documentation; Medication reconciliation procedures; Allergy cross-check procedures; Data quality standards; Accuracy verification methodology,Quarterly medication list completeness percentage; Monthly documentation frequency; OTC medication inclusion rate; Medication reconciliation frequency; Staff competency assessments; Data accuracy verification; Allergy/interaction detection effectiveness,CMS/State audit of medication list documentation; Verification of visit percentages; Review of list completeness and accuracy; Patient chart audits (100+ visits); Medication reconciliation verification; OTC medication tracking; Allergy cross-check testing; Interaction detection effectiveness,Targeted audits of medication list completeness; Random chart audits with medication focus; Data accuracy and completeness testing; OTC medication inclusion verification; Staff competency assessment; Medication reconciliation process review; Allergy/interaction alert testing,Medication list documentation rate; List completeness percentage; Medication accuracy; OTC medication inclusion; Allergy cross-check effectiveness; Medication reconciliation frequency; Staff competency; Patient safety outcomes; Medication error reduction,Non-compliance: Loss of incentive payment; Increased medication error risk; Patient safety concerns; Audit findings; Negative payment adjustment; Loss of meaningful use certification; Potential patient harm from adverse interactions,MU2-Medication List; MU3-Medication List; Hospital Quality Reporting patient safety measures; Promoting Interoperability medication measures,Critical,Active
