title_id,name,description,enactment_date,jurisdiction,authority,status,parent_framework,short_name
HITECH_TITLE_ROOT,Health Information Technology for Economic and Clinical Health Act,Federal law strengthening HIPAA enforcement expanding breach notification requirements extending compliance to business associates and providing incentives for EHR adoption.,2009-02-17,United States (Federal),U.S. Department of Health and Human Services (HHS),Active and regularly enforced,HIPAA (Health Insurance Portability and Accountability Act),HITECH Act
HITECH_TITLE_1,Improved Health Information Technology,Subtitles covering enhanced privacy and security provisions testing of health information technology grants and loans funding and enforcement mechanisms.,2009-02-17,United States (Federal),HHS Office for Civil Rights (OCR),Active and regularly enforced,HITECH Act,Title I
HITECH_TITLE_2,Medicare and Medicaid HIT,Medicare and Medicaid incentives for meaningful use of certified EHR technology and EHR adoption for eligible healthcare providers.,2009-02-17,United States (Federal),Centers for Medicare & Medicaid Services (CMS),Active and regularly enforced,HITECH Act,Title II
HITECH_SUBTITLE_A,Improved Privacy and Security Provisions,Enhanced HIPAA privacy and security protections extended business associate liability tiered penalties breach notification requirements and expanded enforcement authority.,2009-02-17,United States (Federal),HHS Office for Civil Rights (OCR),Active and regularly enforced,HITECH Act Root,Subtitle A
HITECH_SUBTITLE_B,Testing of Health Information Technology,EHR certification standards testing procedures for certified systems and ONC authority to certify electronic health record technology.,2009-02-17,United States (Federal),Office of the National Coordinator (ONC),Active and regularly enforced,HITECH Act Root,Subtitle B
HITECH_SUBTITLE_C,Grants and Loans Funding,Financial resources for EHR adoption workforce training funding and health IT infrastructure support to promote electronic health record adoption.,2009-02-17,United States (Federal),HHS and CMS,Active and regularly enforced,HITECH Act Root,Subtitle C
HITECH_SUBTITLE_D,Privacy and Security Provisions (Enforcement),Enforcement mechanisms tiered civil monetary penalties enhanced OCR authority business associate direct liability breach notification requirements and safe harbor provisions.,2009-02-17,United States (Federal),HHS Office for Civil Rights (OCR),Active and regularly enforced,HITECH Act Root,Subtitle D