node_id,organization_type,role_in_ecosystem,official_definition,primary_responsibilities,secondary_responsibilities,information_shared,participation_model,geographic_scope,member_benefits,communication_channels,real_time_alerting,incident_coordination,threat_analysis_capabilities,reporting_frequency,membership_requirements,confidentiality_protocols,cost_structure,integration_capabilities,key_use_cases
threat_001,Payment Card Industry Threat Intelligence,"Industry-wide payment card fraud and breach threat intelligence coordination managed by PCI Security Standards Council and card networks","Payment card industry threat intelligence program collecting and analyzing payment card breach data, fraud patterns, attack methods, and emerging threats; Coordinated by PCI SSC and card networks; Provides advisories, bulletins, and threat reports; Supports industry awareness and defense","Collect payment card breach data and fraud patterns; Analyze attack methods and tactics; Identify emerging threats to payment systems; Publish security advisories and bulletins; Coordinate incident response across industry; Track threat actors and campaigns; Provide threat intelligence to payment ecosystem; Support forensic investigations; Develop threat-based security controls; Share indicators of compromise (IOCs); Coordinate with law enforcement","Payment fraud trend analysis; Geographic threat mapping; Attack vector identification; Threat actor profiling; Malware analysis; Vulnerability exploitation tracking; Industry benchmarking; Security best practice development; Forensic investigation support; Conference presentations; Training and awareness; Research and innovation; Regulatory coordination","Payment breach data (anonymized); Fraud patterns and statistics; Attack methods and TTPs; Malware samples and IOCs; Compromised card data patterns (no actual card data); Security vulnerabilities exploited; Threat actor information; Geographic threat data; Industry trends; Defensive recommendations; Forensic findings; Security best practices","Open information sharing model; Public advisories and bulletins; Industry participation; Forensic investigator contribution; Card network coordination; Merchant and processor reporting; Public and confidential channels; Research community engagement; Conference presentations; Blog posts and publications","Global payment card industry; 200+ countries; Cross-border threat tracking; International payment networks; Regional threat analysis; Worldwide merchant and processor coverage; International law enforcement coordination; Global forensic investigation support","Access to threat intelligence bulletins; Security advisories and alerts; Breach trend analysis; Attack method information; Best practice guidance; Conference access; Training materials; Forensic guidance; Industry networking; Research findings; Regulatory insight; Early warning of emerging threats","PCI SSC blog and website; Email bulletins; Industry conferences; Webinars and training; Published research reports; Security alerts; Threat advisories; Direct communications to networks/acquirers; Forensic investigator network; Law enforcement liaison; Media and press releases","Real-time alerts for critical threats; Email bulletins for emerging threats; Quarterly threat summaries; Annual threat reports; Conference presentations; Ad-hoc advisories for major incidents; Immediate notification of systemic threats; Critical vulnerability announcements","Incident coordination across payment industry; Forensic investigation coordination; Law enforcement liaison; Cross-industry information sharing; Breach notification coordination; Response best practices; Post-incident analysis; Systemic threat response; Industry-wide defensive measures","Payment card fraud analysis; Breach pattern recognition; Malware analysis; Attack attribution; Threat actor tracking; Vulnerability analysis; Forensic investigation data; Statistical analysis; Trend identification; Predictive threat modeling; Geographic analysis; Industry benchmarking","Quarterly threat reports; Annual industry threat analysis; Weekly or bi-weekly bulletins; Real-time critical alerts; Conference presentations; Research publications; Blog posts; Ad-hoc advisories; Monthly summaries (informal); Continuous online updates","Open access to public information; Forensic investigators contribute detailed findings; Card networks provide network data; Merchants and processors report incidents; Voluntary participation for detailed intelligence; Confidential reporting channels; Industry membership (PCI SSC participating organizations); Law enforcement coordination","Public information openly shared; Confidential breach details anonymized; Sensitive forensic data protected; Information shared per confidentiality agreements; Attribution information handled carefully; Victim information protected; Threat data shared with law enforcement under protocols; Responsible disclosure practiced","Free access to public threat intelligence; PCI SSC participating organization benefits; Conference attendance (registration fees); Training programs (may have fees); Consulting services separate; Forensic investigations (commercial); No cost for basic threat intelligence access","Public APIs (limited); Email alerts; RSS feeds; Blog subscriptions; Research report downloads; Webinar registration; Conference mobile apps; Forensic investigation tools (separate); Security community forums; Social media channels; Partner integrations","Understand payment fraud landscape; Stay informed on attack methods; Benchmark against industry; Develop defensive controls; Inform security investments; Support incident response; Validate security posture; Comply with PCI DSS; Train security teams; Assess vendor risks; Board and executive reporting; Industry awareness"
threat_002,Information Sharing and Analysis Center (ISAC) - Payment and Financial Services,"Member-based threat intelligence sharing organization for payment and financial services sector providing real-time threat alerts and incident coordination","Sector-specific Information Sharing and Analysis Center for payment processors, financial institutions, and payment service providers; Member-driven organization; Real-time threat and vulnerability information sharing; Coordinated incident response; 24/7 operations center; Trusted information sharing community; Sector-specific threat analysis","Real-time threat alert distribution to members; Cyber threat and vulnerability information sharing; Coordinated incident response; 24/7 watch and warning operations; Threat analysis and reporting; Information sharing portal; Secure communications; Member community building; Cross-sector coordination; Government liaison; Law enforcement coordination; Critical infrastructure protection","Threat hunting support; Cyber exercises and simulations; Training and education; Conference and events; Working groups and committees; Best practice development; Regulatory coordination; Vendor coordination; Research and innovation; Tabletop exercises; Threat briefings; Member networking; Industry representation","Member-contributed threat data; Real-time attack indicators; Malware samples and IOCs; Vulnerability information; Incident reports (anonymized); Tactical threat intelligence; Strategic threat assessments; Adversary TTPs; Defensive measures; Mitigation strategies; Lessons learned; Best practices; Tool and technique recommendations","Member-based model; Tiered membership levels; Dues-paying members; Active participation expected; Information contribution encouraged; Trusted community; Reciprocal sharing; Non-attribution by default; Sector-specific focus; Cross-sector coordination with other ISACs","Financial services sector (payment processors, banks, credit unions, fintechs, payment service providers); North America focus with international reach; Coordination with international ISACs; Cross-border threat sharing; Regional threat analysis; Global member coverage","Real-time threat alerts (email, portal, SMS); 24/7 incident hotline; Secure member portal; Threat analysis reports; Vulnerability bulletins; Best practice guidance; Member community access; Working group participation; Conference attendance; Training programs; Tabletop exercises; Member directory; Coordinated response support","24/7 real-time alerting via multiple channels (email, SMS, portal notifications); Immediate critical threat alerts; Time-sensitive vulnerability notifications; Attack in-progress warnings; Zero-day vulnerability alerts; Sector-wide incident notifications; Coordinated response calls; Emergency conference bridges","Central coordination of member incidents; Incident response working groups; Cross-member information sharing; Coordinated defense strategies; Government and law enforcement liaison; Forensic resource coordination; Best practice dissemination; Post-incident analysis; Tabletop exercises; Simulations; Crisis communications","Threat analysis team; Sector-specific expertise; Tactical and strategic intelligence; Adversary profiling; Campaign tracking; Malware analysis; Vulnerability assessment; Trend analysis; Predictive intelligence; Attribution support; Geopolitical analysis; Emerging threat identification","Real-time alerts (immediate); Daily threat summaries; Weekly intelligence reports; Monthly analysis reports; Quarterly sector assessments; Annual threat landscape; Ad-hoc briefings; Flash alerts; Member-only webinars; Conference presentations; Working group reports","Membership application and approval; Payment of annual membership dues; Active participation in information sharing; Contribution of threat intelligence; Adherence to sharing agreements; Security and confidentiality protocols; Trusted community standing; Sector relevance; Executive sponsorship; Designated representatives","TLP (Traffic Light Protocol) for information classification; Non-attribution default; Member anonymity protected; Secure communications; Encrypted channels; Confidentiality agreements; Information handling procedures; Sensitive information protection; Victim confidentiality; Coordinated disclosure; Law enforcement liaison protocols","Membership dues (typically $10K-$250K+ annually based on organization size and tier); Volume-based pricing; Tiered membership levels; Non-profit sector discounts; Government/public sector special pricing; Academic/research reduced rates; Payment processor tiers; Additional services may have fees","Secure member portal with APIs; STIX/TAXII feeds; Email alerts; SMS notifications; Slack/Teams integration; SIEM integration capabilities; Threat intelligence platform integration; Ticketing system integration; GRC platform feeds; Automated IOC ingestion; Webhook support; Mobile apps","Real-time threat awareness; Early warning of attacks; Coordinated incident response; Peer information sharing; Regulatory coordination; Best practice learning; Vendor risk intelligence; Compliance support; Board reporting; Security program validation; Threat hunting; Forensic support; Training and exercises; Community building; Industry representation; Government liaison"
threat_003,Commercial Threat Intelligence Provider,"Commercial cybersecurity and threat intelligence vendor providing subscription-based threat intelligence services to payment and financial services organizations","Commercial vendor providing subscription-based cyber threat intelligence, malware analysis, vulnerability intelligence, and threat actor tracking; Serves payment processors, merchants, and financial institutions; Combines open-source intelligence (OSINT), commercial feeds, proprietary research, and global telemetry","Threat intelligence feed provision; Malware analysis and reverse engineering; Vulnerability intelligence; Threat actor tracking and attribution; Indicators of Compromise (IOCs); Threat hunting support; Security research; Custom threat intelligence; Executive threat briefings; Integration with security tools; 24/7 threat monitoring; Incident response intelligence support","Penetration testing services; Red team engagements; Managed detection and response (MDR); Incident response services; Forensics; Security consulting; Training and certification; Threat hunting services; Security operations center (SOC) services; Vulnerability management; Risk assessments; Compliance consulting; Tool integration services","Threat intelligence feeds (IOCs, domains, IPs, file hashes); Malware analysis reports; Vulnerability intelligence; Exploit information; Threat actor profiles and TTPs; Campaign tracking; Phishing and fraud intelligence; Dark web monitoring; Brand protection intelligence; Executive threat reports; Custom intelligence; Geopolitical analysis; Industry-specific threats","Commercial subscription model; Tiered service levels; API access; Per-user or per-feed pricing; Enterprise agreements; Platform-based delivery; Self-service portal; Analyst support included; Custom intelligence available; Professional services add-ons","Global threat intelligence; Coverage of 100-200+ countries; Worldwide telemetry and sensors; Dark web monitoring globally; Multilingual analysis; Regional threat specialization; Local analyst expertise; International threat tracking; Cross-border cybercrime; Global incident response","Machine-readable threat feeds; Analyst-curated intelligence; Custom research; Executive briefings; Threat hunting queries; Security tool integrations; Training and education; Analyst support; Community access; Threat actor profiles; Vulnerability intelligence; Industry reports; Conference access (some vendors)","RESTful APIs; STIX/TAXII feeds; JSON/XML formats; SIEM integration; TIP integration; Email alerts; Web portal; Mobile apps; Slack/Teams integration; Threat hunting tools; Analyst chat; Support ticketing; Documentation; Sandbox access (some vendors)","Real-time feed updates; Continuous IOC streams; Immediate critical threat alerts; Hourly feed refreshes; Flash alerts for zero-days; Analyst alerts for emerging threats; Customizable alert thresholds; Integration-based delivery; Push and pull models; Webhook notifications","Threat intelligence support during incidents; IOC lookups; Malware analysis on demand; Threat actor attribution; Campaign identification; Forensic intelligence; Remediation guidance; Indicators of exposure; Compromise assessment intelligence; Incident report enrichment","Proprietary threat research; Global telemetry networks; Malware sandboxes; Reverse engineering; Human analyst curation; Machine learning and AI; Behavioral analysis; Dark web monitoring; OSINT collection; Commercial data feeds; Sensor networks; Honeypots; Sinkholes; Partnerships","Real-time feeds (continuous); Daily intelligence reports; Weekly analyst reports; Monthly threat landscape; Quarterly executive summaries; Annual threat reports; Ad-hoc flash alerts; Custom report requests; On-demand research; Threat briefings; Vulnerability bulletins","Subscription payment; Service agreement; API credentials; Integration support; Training (included or add-on); Service level agreements; Enterprise licensing; Multi-year commitments; Volume-based pricing; Proof of concept trials available","Commercial confidentiality; TLP classifications supported; Customer data protection; Anonymized intelligence; Proprietary research protection; Sharing restrictions; Export controls (some intelligence); Regulatory compliance; Customer usage restrictions; Attribution policies","Subscription fees ($10K-$500K+ annually); Tiered pricing based on: Feed selection, user count, API calls, organization size, service level; Professional services separate; Custom intelligence additional; Training and certification fees; Proof of concept (POC) available; Enterprise volume discounts","REST APIs; STIX/TAXII; SIEM connectors (Splunk, QRadar, ArcSight, etc.); TIP integration (ThreatConnect, Anomali, etc.); SOAR integration; EDR/XDR integration; Firewall/IPS integration; CASB integration; Cloud security integration; Ticketing integration (ServiceNow, Jira); Webhook and custom integrations","Threat detection and hunting; Incident response; SOC operations; Vulnerability management; Risk assessment; Executive reporting; Security tool optimization; Threat modeling; Red team exercises; Compliance evidence; Due diligence; M&A security; Third-party risk; Proactive defense; Threat prioritization"
threat_004,Open-Source Threat Intelligence (OSINT) Community,"Community-driven open-source threat intelligence sharing through public repositories, feeds, and collaborative platforms","Open-source and community-driven threat intelligence sharing; Public IOC repositories; GitHub threat feeds; Community malware analysis; Volunteer-driven projects; Free access to baseline threat intelligence; Collaborative defense; Academic and research community; Democratized threat intelligence","Community IOC sharing; Public malware sample repositories; Open-source threat feeds; Collaborative threat hunting; Honeypot data sharing; Vulnerability disclosure; Public malware analysis; Community research; Open-source security tools; Educational content; Public breach databases (historical); Community forums and discussions","Security research publication; Open-source tool development; Training and education; Conference presentations; Blog posts and write-ups; YouTube and video tutorials; Podcasts; Community Slack/Discord channels; Twitter threat intelligence; GitHub repositories; Academic collaboration; Student and researcher support","Public indicators of compromise (domains, IPs, hashes); Malware samples; Phishing URLs; Threat actor IOCs; Vulnerability information; Exploit code (sometimes); Security tool signatures; YARA rules; Sigma rules; Snort/Suricata rules; Public breach data; Threat reports; Analysis write-ups; Research papers","Open community model; Free public access; Voluntary contribution; No membership required; Community-driven curation; GitHub-based; Public repositories; Collaborative platforms; Academic and research; No commercial restriction; Attribution and credit culture","Global community; International contributors; Worldwide accessibility; Language barriers (mostly English); Regional community chapters; Online-first; No geographic restrictions; Distributed globally; Volunteer worldwide; Open to all countries","Free threat intelligence; Public IOC feeds; Malware sample access; Community knowledge; Learning opportunities; Networking; Open-source tools; Research data; Academic resources; Training content; Community recognition; Skill development; Career building","GitHub repositories; Public APIs; Twitter feeds; RSS feeds; Community Slack/Discord; Reddit communities; Security blogs; Mailing lists; Public databases; Pastebin and similar; Telegram channels; Conference talks; YouTube videos; Podcasts","Varies by source; Some real-time (Twitter, feeds); Daily updates common; Weekly curated lists; Monthly compilations; Ad-hoc as community discovers; No SLAs; Best-effort; Community-driven timing","Informal community coordination; Shared analysis in forums; Collaborative hunting; Twitter threads; Blog post sharing; GitHub issues and PRs; Community calls (some groups); Conference meetups; Slack/Discord discussions; No formal incident response","Community expertise; Volunteer analysis; Crowdsourced intelligence; Open-source tools; Academic research; Student projects; Hobbyist analysis; Professional contribution (off-hours); Automated collection and aggregation; Machine learning experiments; Limited compared to commercial","Continuous community updates; Daily feed updates (many sources); Weekly curated roundups; Monthly community reports; Annual retrospectives; Conference presentations; Research paper publication; Blog post frequency (varies); Ad-hoc as discovered","Open participation; GitHub account (many sources); Attribution and credit given; Community guidelines adherence; Constructive contribution; No quality requirements (varies); Email signup (some feeds); API access open or limited; Community standing earned over time","Public information sharing; Attribution given; No confidentiality guarantees; Sensitive data avoided; Responsible disclosure practiced; Vendor coordination (varies); No private channels; Public-by-default; Some anonymity respected; Ethical boundaries","Free (no cost); Donation-supported (some projects); Volunteer time; Community contribution; Open-source licensing; Academic support; Grant funding (some projects); Conference sponsorships; No commercial fees; Freemium models (some)","Public APIs (rate-limited); RSS feeds; GitHub raw files; JSON/CSV downloads; Public STIX/TAXII (some); Web scraping (allowed by some); Command-line tools; Python libraries; Community-built integrations; Manual copy-paste; No SLAs or guarantees","Baseline threat intelligence; Learning and research; Small organization defense; Academic study; Personal projects; Threat hunting practice; Signature development; Open-source tool testing; Community contribution; Supplementing commercial feeds; Student learning; Hobbyist security; Budget-constrained orgs; Proof of concept"
