control_id,control_name,control_text,domain_identifier,pptdf_scope,control_question,relative_weighting,nist_csf_function,is_new_control,is_mcr,is_dsr,control_type
IAC-06.4,Out-of-Band Multi-Factor Authentication ,Mechanisms exist to implement Multi-Factor Authentication (MFA) for access to privileged and non-privileged accounts such that one of the factors is independently provided by a device separate from the system being accessed. ,IAC,Technology,Does the organization implements Multi-Factor Authentication (MFA) for access to privileged and non-privileged accounts such that one of the factors is securely provided by a device separate from the system gaining access? ,5,Protect,No,No,No,SCF
IAC-07,User Provisioning & De-Provisioning ,Mechanisms exist to utilize a formal user registration and de-registration process that governs the assignment of access rights. ,IAC,Technology,Does the organization utilize a formal user registration and de-registration process that governs the assignment of access rights? ,10,Protect,No,No,No,SCF
IAC-07.1,Change of Roles & Duties,"Mechanisms exist to revoke user access rights following changes in personnel roles and duties, if no longer necessary or permitted. ",IAC,Technology,"Does the organization revoke user access rights following changes in personnel roles and duties, if no longer necessary or permitted? ",10,Protect,No,No,No,SCF
IAC-07.2,Termination of Employment,"Mechanisms exist to revoke user access rights in a timely manner, upon termination of employment or contract.",IAC,Technology,"Does the organization revoke user access rights in a timely manner, upon termination of employment or contract?",10,Protect,No,No,No,SCF
IAC-08,Role-Based Access Control (RBAC) ,Mechanisms exist to enforce a Role-Based Access Control (RBAC) policy over users and resources that applies need-to-know and fine-grained access control for sensitive/regulated data access.,IAC,Technology,Does the organization enforce a Role-Based Access Control (RBAC) policy over users and resources that applies need-to-know and fine-grained access control for sensitive/regulated data access?,9,Protect,No,No,No,SCF
IAC-09,Identifier Management (User Names),Mechanisms exist to govern naming standards for usernames and systems.,IAC,Technology,Does the organization govern naming standards for usernames and systems?,9,Protect,No,No,No,SCF
IAC-09.1,User Identity (ID) Management ,Mechanisms exist to ensure proper user identification management for non-consumer users and administrators. ,IAC,Technology,Does the organization ensure proper user identification management for non-consumer users and administrators? ,9,Protect,No,No,No,SCF
IAC-09.2,Identity User Status,Mechanisms exist to identify contractors and other third-party users through unique username characteristics. ,IAC,Technology,Does the organization identify contractors and other third-party users through unique username characteristics? ,7,Protect,No,No,No,SCF
IAC-09.3,Dynamic Management,Mechanisms exist to dynamically manage usernames and system identifiers. ,IAC,Technology,Does the organization dynamically manage usernames and system identifiers? ,5,Protect,No,No,No,SCF
IAC-09.4,Cross-Organization Management,Mechanisms exist to coordinate username identifiers with external organizations for cross-organization management of identifiers. ,IAC,Technology,Does the organization coordinate username identifiers with external organizations for cross-organization management of identifiers? ,5,Protect,No,No,No,SCF
IAC-09.5,Privileged Account Identifiers,Mechanisms exist to uniquely manage privileged accounts to identify the account as a privileged user or service.,IAC,Technology,Does the organization uniquely manage privileged accounts to identify the account as a privileged user or service?,9,Protect,No,No,No,SCF
IAC-09.6,Pairwise Pseudonymous Identifiers (PPID),Mechanisms exist to generate pairwise pseudonymous identifiers with no identifying information about a data subject to discourage activity tracking and profiling of the data subject.,IAC,Technology,Does the organization generate pairwise pseudonymous identifiers with no identifying information about a data subject to discourage activity tracking and profiling of the data subject?,1,Protect,No,No,No,SCF
IAC-10,Authenticator Management,"Mechanisms exist to:
(1) Securely manage authenticators for users and devices; and
(2) Ensure the strength of authentication is appropriate to the classification of the data being accessed.",IAC,Technology,"Does the organization:
(1) Securely manage authenticators for users and devices; and
(2) Ensure the strength of authentication is appropriate to the classification of the data being accessed?",10,Protect,No,No,No,SCF
IAC-10.1,Password-Based Authentication ,"Mechanisms exist to enforce complexity, length and lifespan considerations to ensure strong criteria for password-based authentication.",IAC,Technology,"Does the organization enforce complexity, length and lifespan considerations to ensure strong criteria for password-based authentication?",9,Protect,No,No,No,SCF
IAC-10.10,Expiration of Cached Authenticators,Automated mechanisms exist to prohibit the use of cached authenticators after organization-defined time period.,IAC,Technology,Does the organization use automated mechanisms to prohibit the use of cached authenticators after organization-defined time period?,5,Protect,No,No,No,SCF
IAC-10.11,Password Managers,Mechanisms exist to protect and store passwords via a password manager tool.,IAC,Technology,Does the organization protect and store passwords via a password manager tool?,8,Protect,No,No,No,SCF
IAC-10.12,Biometric Authentication,Mechanisms exist to ensure biometric-based authentication satisfies organization-defined biometric quality requirements for false positives and false negatives.,IAC,Technology,Does the organization ensure biometric-based authentication satisfies organization-defined biometric quality requirements for false positives and false negatives?,5,Protect,No,No,No,SCF
IAC-10.13,Events Requiring Authenticator Change,"Mechanisms exist to change authentication credentials:
(1) At predefined intervals; and/or
(2) Upon suspicion of credential compromise.",IAC,Process,"Does the organization change authentication credentials:
(1) At predefined intervals; and/or
(2) Upon suspicion of credential compromise?",9,Protect,Yes,No,No,SCF
IAC-10.2,PKI-Based Authentication,Automated mechanisms exist to validate certificates by constructing and verifying a certification path to an accepted trust anchor including checking certificate status information for PKI-based authentication.,IAC,Technology,Does the organization use automated mechanisms to validate certificates by constructing and verifying a certification path to an accepted trust anchor including checking certificate status information for PKI-based authentication?,9,Protect,No,No,No,SCF
IAC-10.3,In-Person or Trusted Third-Party Registration,Mechanisms exist to conduct in-person or trusted third-party identify verification before user accounts for third-parties are created.,IAC,People,Does the organization conduct in-person or trusted third-party identify verification before user accounts for third-parties are created?,9,Protect,No,No,No,SCF
IAC-10.4,Automated Support For Password Strength,Automated mechanisms exist to determine if password authenticators are sufficiently strong enough to satisfy organization-defined password length and complexity requirements. ,IAC,Technology,Does the organization use automated mechanisms to determine if password authenticators are sufficiently strong enough to satisfy organization-defined password length and complexity requirements? ,5,Protect,No,No,No,SCF
IAC-10.5,Protection of Authenticators,Mechanisms exist to protect authenticators commensurate with the sensitivity of the information to which use of the authenticator permits access. ,IAC,Technology,Does the organization protect authenticators commensurate with the sensitivity of the information to which use of the authenticator permits access? ,10,Protect,No,No,No,SCF
IAC-10.6,No Embedded Unencrypted Static Authenticators,"Mechanisms exist to ensure that unencrypted, static authenticators are not embedded in applications, scripts or stored on function keys. ",IAC,Technology,"Does the organization ensure that unencrypted, static authenticators are not embedded in applications, scripts or stored on function keys? ",10,Protect,No,No,No,SCF
IAC-10.7,Hardware Token-Based Authentication,Automated mechanisms exist to ensure organization-defined token quality requirements are satisfied for hardware token-based authentication.,IAC,Technology,Does the organization use automated mechanisms to ensure organization-defined token quality requirements are satisfied for hardware token-based authentication?,9,Protect,No,No,No,SCF
IAC-10.8,Default Authenticators,Mechanisms exist to ensure default authenticators are changed as part of account creation or system installation.,IAC,Technology,Does the organization ensure default authenticators are changed as part of account creation or system installation?,10,Protect,No,No,No,SCF
IAC-10.9,Multiple Information System Accounts,Mechanisms exist to implement security safeguards to manage the risk of compromise due to individuals having accounts on multiple information systems.,IAC,Technology,Does the organization implement security safeguards to manage the risk of compromise due to individuals having accounts on multiple information systems?,5,Protect,No,No,No,SCF
IAC-11,Authenticator Feedback,Mechanisms exist to obscure the feedback of authentication information during the authentication process to protect the information from possible exploitation/use by unauthorized individuals. ,IAC,Technology,Does the organization obscure the feedback of authentication information during the authentication process to protect the information from possible exploitation/use by unauthorized individuals? ,6,Protect,No,No,No,SCF
IAC-12,Cryptographic Module Authentication ,"Mechanisms exist to ensure cryptographic modules adhere to applicable statutory, regulatory and contractual requirements for security strength.",IAC,Technology,"Does the organization ensure cryptographic modules adhere to applicable statutory, regulatory and contractual requirements for security strength?",8,Protect,No,No,No,SCF
IAC-12.1,Hardware Security Modules (HSM),Automated mechanisms exist to utilize Hardware Security Modules (HSM) to protect authenticators on which the component relies. ,IAC,Technology,Does the organization use automated mechanisms to utilize Hardware Security Modules (HSM) to protect authenticators on which the component relies? ,3,Protect,No,No,No,SCF
IAC-13,Adaptive Identification & Authentication ,Mechanisms exist to allow individuals to utilize alternative methods of authentication under specific circumstances or situations.,IAC,Technology,Does the organization allow individuals to utilize alternative methods of authentication under specific circumstances or situations?,5,Protect,No,No,No,SCF
IAC-13.1,Single Sign-On (SSO) Transparent Authentication,"Mechanisms exist to provide a transparent authentication (e.g., Single Sign-On (SSO)) capability to the organization's systems and services.",IAC,Technology,Does the organization provide a Single Sign-On (SSO) capability to its systems and services?,5,Protect,No,No,No,SCF
IAC-13.2,Federated Credential Management,Mechanisms exist to federate credentials to allow cross-organization authentication of individuals and devices.,IAC,Technology,Does the organization federate credentials to allow cross-organization authentication of individuals and devices?,4,Protect,No,No,No,SCF
IAC-13.3,Continuous Authentication,Automated mechanisms exist to enable continuous re-authentication through the lifecycle of entity interactions.,IAC,Technology,Does the organization use automated mechanisms to enable continuous re-authentication through the lifecycle of entity interactions?,2,Protect,No,No,No,SCF
IAC-14,Re-Authentication ,Mechanisms exist to force users and devices to re-authenticate according to organization-defined circumstances that necessitate re-authentication. ,IAC,Technology,Does the organization force users and devices to re-authenticate according to organization-defined circumstances that necessitate re-authentication? ,8,Protect,No,No,No,SCF
IAC-15,Account Management ,"Mechanisms exist to proactively govern account management of individual, group, system, service, application, guest and temporary accounts.",IAC,Technology,"Does the organization proactively govern account management of individual, group, system, service, application, guest and temporary accounts?",10,Protect,No,No,No,SCF
IAC-15.1,Automated System Account Management (Directory Services) ,"Automated mechanisms exist to support the management of system accounts (e.g., directory services). ",IAC,Technology,Does the organization use automated mechanisms to support the management of system accounts? ,5,Protect,No,No,No,SCF
IAC-15.2,Removal of Temporary / Emergency Accounts,Automated mechanisms exist to disable or remove temporary and emergency accounts after an organization-defined time period for each type of account. ,IAC,Technology,Does the organization use automated mechanisms to disable or remove temporary and emergency accounts after an organization-defined time period for each type of account? ,9,Protect,No,No,No,SCF
IAC-15.3,Disable Inactive Accounts,Automated mechanisms exist to disable inactive accounts after an organization-defined time period. ,IAC,Technology,Does the organization use automated mechanisms to disable inactive accounts after an organization-defined time period? ,10,Protect,No,No,No,SCF
IAC-15.4,Automated Audit Actions,"Automated mechanisms exist to audit account creation, modification, enabling, disabling and removal actions and notify organization-defined personnel or roles. ",IAC,Technology,"Does the organization use automated mechanisms to audit account creation, modification, enabling, disabling and removal actions and notify organization-defined personnel or roles? ",5,Protect,No,No,No,SCF
IAC-15.5,Restrictions on Shared Groups / Accounts,Mechanisms exist to authorize the use of shared/group accounts only under certain organization-defined conditions.,IAC,Technology,Does the organization authorize the use of shared/group accounts only under certain organization-defined conditions?,10,Protect,No,No,No,SCF
IAC-15.6,Account Disabling for High Risk Individuals,Mechanisms exist to disable accounts immediately upon notification for users posing a significant risk to the organization.,IAC,Technology,Does the organization disable accounts immediately upon notification for users posing a significant risk to the organization?,10,Protect,No,No,No,SCF
IAC-15.7,System Account Reviews,Mechanisms exist to review all system accounts and disable any account that cannot be associated with a business process and owner. ,IAC,Technology,Does the organization review all system accounts and disables any account that cannot be associated with a business process and owner? ,10,Protect,No,No,No,SCF
IAC-15.8,Usage Conditions,Automated mechanisms exist to enforce usage conditions for users and/or roles.,IAC,Technology,Does the organization use automated mechanisms to enforce usage conditions for users and/or roles?,5,Protect,No,No,No,SCF
IAC-15.9,Emergency Accounts,"Mechanisms exist to establish and control ""emergency access only"" accounts.",IAC,Technology,"Does the organization establish and control ""emergency access only"" accounts?",5,Respond,No,No,No,SCF
IAC-16,Privileged Account Management (PAM) ,Mechanisms exist to restrict and control privileged access rights for users and services.,IAC,Technology,Does the organization restrict and control privileged access rights for users and services?,10,Protect,No,No,No,SCF
IAC-16.1,Privileged Account Inventories ,Mechanisms exist to inventory all privileged accounts and validate that each person with elevated privileges is authorized by the appropriate level of organizational management. ,IAC,Technology,Does the organization inventory all privileged accounts and validate that each person with elevated privileges is authorized by the appropriate level of organizational management? ,10,Protect,No,No,No,SCF
IAC-16.2,Privileged Account Separation ,Mechanisms exist to separate privileged accounts between infrastructure environments to reduce the risk of a compromise in one infrastructure environment from laterally affecting other infrastructure environments.,IAC,Technology,Does the organization separate privileged accounts between infrastructure environments to reduce the risk of a compromise in one infrastructure environment from laterally affecting other infrastructure environments?,4,Protect,No,No,No,SCF
IAC-17,Periodic Review of Account Privileges,"Mechanisms exist to periodically-review the privileges assigned to individuals and service accounts to validate the need for such privileges and reassign or remove unnecessary privileges, as necessary.",IAC,Process,"Does the organization periodically-review the privileges assigned to individuals and service accounts to validate the need for such privileges and reassign or remove unnecessary privileges, as necessary?",10,Detect,No,No,No,SCF
IAC-18,User Responsibilities for Account Management,"Mechanisms exist to compel users to follow accepted practices in the use of authentication mechanisms (e.g., passwords, passphrases, physical or logical security tokens, smart cards, certificates, etc.). ",IAC,People,"Does the organization compel users to follow accepted practices in the use of authentication mechanisms (e.g., passwords, passphrases, physical or logical security tokens, smart cards, certificates, etc.)? ",10,Protect,No,No,No,SCF
IAC-19,Credential Sharing ,"Mechanisms exist to prevent the sharing of generic IDs, passwords or other generic authentication methods.",IAC,Process,"Does the organization prevent the sharing of generic IDs, passwords or other generic authentication methods?",10,Protect,No,No,No,SCF
IAC-20,Access Enforcement,"Mechanisms exist to enforce Logical Access Control (LAC) permissions that conform to the principle of ""least privilege.""",IAC,Technology,"Does the organization enforce Logical Access Control (LAC) permissions that conform to the principle of ""least privilege?""",10,Protect,No,No,No,SCF
IAC-20.1,Access To Sensitive / Regulated Data,Mechanisms exist to limit access to sensitive/regulated data to only those individuals whose job requires such access. ,IAC,Data,Does the organization limit access to sensitive/regulated data to only those individuals whose job requires such access? ,10,Protect,No,No,No,SCF
IAC-20.2,Database Access,Mechanisms exist to restrict access to databases containing sensitive/regulated data to only necessary services or those individuals whose job requires such access. ,IAC,Technology,Does the organization restrict access to databases containing sensitive/regulated data to only necessary services or those individuals whose job requires such access?,10,Protect,No,No,No,SCF
IAC-20.3,Use of Privileged Utility Programs,Mechanisms exist to restrict and tightly control utility programs that are capable of overriding system and application controls.,IAC,Technology,Does the organization restrict and tightly control utility programs that are capable of overriding system and application controls?,9,Protect,No,No,No,SCF
IAC-20.4,Dedicated Administrative Machines,Mechanisms exist to restrict executing administrative tasks or tasks requiring elevated access to a dedicated machine.,IAC,Technology,Does the organization restrict executing administrative tasks or tasks requiring elevated access to a dedicated machine?,8,Protect,No,No,No,SCF
IAC-20.5,Dual Authorization for Privileged Commands,Automated mechanisms exist to enforce dual authorization for privileged commands.,IAC,Technology,Does the organization use automated mechanisms to enforce dual authorization for privileged commands?,5,Protect,No,No,No,SCF
IAC-20.6,Revocation of Access Authorizations,Mechanisms exist to revoke logical and physical access authorizations.,IAC,Technology,Does the organization revoke logical and physical access authorizations?,9,Protect,No,No,No,SCF
IAC-20.7,Authorized System Accounts,"Mechanisms exist to define and document the types of accounts allowed and prohibited on systems, applications and services.",IAC,Technology,"Does the organization define and document the types of accounts allowed and prohibited on systems, applications and services?",9,Protect,No,No,No,SCF
IAC-21,Least Privilege ,"Mechanisms exist to utilize the concept of least privilege, allowing only authorized access to processes necessary to accomplish assigned tasks in accordance with organizational business functions. ",IAC,Technology,"Does the organization utilize the concept of least privilege, allowing only authorized access to processes necessary to accomplish assigned tasks in accordance with organizational business functions? ",10,Protect,No,No,No,SCF
IAC-21.1,Authorize Access to Security Functions ,Mechanisms exist to limit access to security functions to explicitly-authorized privileged users.,IAC,Technology,Does the organization limit access to security functions to explicitly-authorized privileged users?,9,Protect,No,No,No,SCF
IAC-21.2,Non-Privileged Access for Non-Security Functions ,"Mechanisms exist to prohibit privileged users from using privileged accounts, while performing non-security functions. 
",IAC,Technology,"Does the organization prohibit privileged users from using privileged accounts, while performing non-security functions? 
",9,Protect,No,No,No,SCF
IAC-21.3,Privileged Accounts ,Mechanisms exist to restrict the assignment of privileged accounts to management-approved personnel and/or roles.,IAC,Technology,Does the organization restrict the assignment of privileged accounts to management-approved personnel and/or roles?,10,Protect,No,No,No,SCF
IAC-21.4,Auditing Use of Privileged Functions ,Mechanisms exist to audit the execution of privileged functions. ,IAC,Process,Does the organization audit the execution of privileged functions? ,9,Detect,No,No,No,SCF
IAC-21.5,Prohibit Non-Privileged Users from Executing Privileged Functions ,"Mechanisms exist to prevent non-privileged users from executing privileged functions to include disabling, circumventing or altering implemented security safeguards / countermeasures. ",IAC,Technology,"Does the organization prevent non-privileged users from executing privileged functions to include disabling, circumventing or altering implemented security safeguards / countermeasures? ",9,Protect,No,No,No,SCF
IAC-21.6,Network Access to Privileged Commands,"Mechanisms exist to authorize remote access to perform privileged commands on critical systems or where sensitive/regulated data is stored, transmitted and/or processed only for compelling operational needs.",IAC,Technology,"Does the organization authorize remote access to perform privileged commands on critical systems or where sensitive/regulated data is stored, transmitted and/or processed only for compelling operational needs?",5,Protect,No,No,No,SCF
IAC-21.7,Privilege Levels for Code Execution,Automated mechanisms exist to prevent applications from executing at higher privilege levels than the user's privileges. ,IAC,Technology,Does the organization use automated mechanisms to prevent applications from executing at higher privilege levels than the user's privileges? ,5,Protect,No,No,No,SCF
IAC-22,Account Lockout ,Mechanisms exist to enforce a limit for consecutive invalid login attempts by a user during an organization-defined time period and automatically locks the account when the maximum number of unsuccessful attempts is exceeded.,IAC,Technology,Does the organization enforce a limit for consecutive invalid login attempts by a user during an organization-defined time period and automatically locks the account when the maximum number of unsuccessful attempts is exceeded?,9,Protect,No,No,No,SCF
IAC-23,Concurrent Session Control,Mechanisms exist to limit the number of concurrent sessions for each system account. ,IAC,Technology,Does the organization limit the number of concurrent sessions for each system account? ,6,Protect,No,No,No,SCF
IAC-24,Session Lock ,"Mechanisms exist to initiate a session lock after an organization-defined time period of inactivity, or upon receiving a request from a user and retain the session lock until the user reestablishes access using established identification and authentication methods.",IAC,Technology,"Does the organization initiate a session lock after an organization-defined time period of inactivity, or upon receiving a request from a user and retain the session lock until the user reestablishes access using established identification and authentication methods?",9,Protect,No,No,No,SCF
IAC-24.1,Pattern-Hiding Displays ,Mechanisms exist to implement pattern-hiding displays to conceal information previously visible on the display during the session lock. ,IAC,Technology,Does the organization implement pattern-hiding displays to conceal information previously visible on the display during the session lock? ,9,Protect,No,No,No,SCF
IAC-25,Session Termination ,"Automated mechanisms exist to log out users, both locally on the network and for remote sessions, at the end of the session or after an organization-defined period of inactivity. ",IAC,Technology,"Does the organization use automated mechanisms to log out users, both locally on the network and for remote sessions, at the end of the session or after an organization-defined period of inactivity? ",9,Protect,No,No,No,SCF
