control_id,control_name,control_text,domain_identifier,pptdf_scope,control_question,relative_weighting,nist_csf_function,is_new_control,is_mcr,is_dsr,control_type
CHG-04.5,Library Privileges,Mechanisms exist to restrict software library privileges to those individuals with a pertinent business need for access. ,CHG,Technology,Does the organization restrict software library privileges to those individuals with a pertinent business need for access? ,8,Protect,No,No,No,SCF
CHG-05,Stakeholder Notification of Changes ,Mechanisms exist to ensure stakeholders are made aware of and understand the impact of proposed changes. ,CHG,Process,Does the organization ensure stakeholders are made aware of and understand the impact of proposed changes? ,9,Protect,No,No,No,SCF
CHG-06,Control Functionality Verification,Mechanisms exist to verify the functionality of cybersecurity and/or data privacy controls following implemented changes to ensure applicable controls operate as designed. ,CHG,Process,Does the organization verify the functionality of cybersecurity and/or data privacy controls following implemented changes to ensure applicable controls operate as designed?,9,Protect,No,No,No,SCF
CHG-06.1,Report Verification Results,Mechanisms exist to report the results of cybersecurity & data privacy function verification to appropriate organizational management.,CHG,Process,Does the organization report the results of cybersecurity & data privacy function verification to appropriate organizational management?,5,Identify,No,No,No,SCF
CHG-07,Emergency Changes,"Mechanisms exist to govern change management procedures for ""emergency"" changes.",CHG,Process,"Does the organization govern change management procedures for ""emergency"" changes?",9,Protect,Yes,No,No,SCF
CHG-07.1,Documenting Emergency Changes,"Mechanisms exist to document the results of ""emergency"" changes, including an explanation for why standard change management procedures could not be followed.",CHG,Process,"Does the organization document the results of ""emergency"" changes, including an explanation for why standard change management procedures could not be followed?",7,Protect,Yes,No,No,SCF
CLD-01,Cloud Services,Mechanisms exist to facilitate the implementation of cloud management controls to ensure cloud instances are secure and in-line with industry practices. ,CLD,Process,Does the organization facilitate the implementation of cloud management controls to ensure cloud instances are secure and in-line with industry practices? ,10,Govern,No,No,No,SCF
CLD-01.1,Cloud Infrastructure Onboarding,"Mechanisms exist to ensure cloud services are designed and configured so systems, applications and processes are secured in accordance with applicable organizational standards, as well as statutory, regulatory and contractual obligations.",CLD,Process,"Does the organization ensure cloud services are designed and configured so systems, applications and processes are secured in accordance with applicable organizational standards, as well as statutory, regulatory and contractual obligations?",9,Protect,No,No,No,SCF
CLD-01.2,Cloud Infrastructure Offboarding,"Mechanisms exist to ensure cloud services are decommissioned so that data is securely transitioned to new systems or archived in accordance with applicable organizational standards, as well as statutory, regulatory and contractual obligations.",CLD,Process,"Does the organization ensure cloud services are decommissioned so that data is securely transitioned to new systems or archived in accordance with applicable organizational standards, as well as statutory, regulatory and contractual obligations?",9,Protect,No,No,No,SCF
CLD-02,Cloud Security Architecture ,"Mechanisms exist to ensure the cloud security architecture supports the organization's technology strategy to securely design, configure and maintain cloud employments. ",CLD,Process,"Does the organization ensure the cloud security architecture supports its technology strategy to securely design, configure and maintain cloud employments? ",8,Protect,No,No,No,SCF
CLD-03,Cloud Infrastructure Security Subnet,Mechanisms exist to host security-specific technologies in a dedicated subnet.,CLD,Technology,Does the organization host security-specific technologies in a dedicated subnet?,6,Protect,No,No,No,SCF
CLD-04,Application & Program Interface (API) Security ,Mechanisms exist to ensure support for secure interoperability between components with Application & Program Interfaces (APIs).,CLD,Technology,Does the organization ensure support for secure interoperability between components with Application & Program Interfaces (APIs)?,9,Protect,No,No,No,SCF
CLD-05,Virtual Machine Images ,Mechanisms exist to ensure the integrity of virtual machine images at all times. ,CLD,Technology,Does the organization ensure the integrity of virtual machine images at all times? ,8,Protect,No,No,No,SCF
CLD-06,Multi-Tenant Environments ,Mechanisms exist to ensure multi-tenant owned or managed assets (physical and virtual) are designed and governed such that provider and customer (tenant) user access is appropriately segmented from other tenant users.,CLD,Technology,Does the organization ensure multi-tenant owned or managed assets (physical and virtual) are designed and governed such that provider and customer (tenant) user access is appropriately segmented from other tenant users?,9,Protect,No,No,No,SCF
CLD-06.1,Customer Responsibility Matrix (CRM),"Mechanisms exist to formally document a Customer Responsibility Matrix (CRM), delineating assigned responsibilities for controls between the Cloud Service Provider (CSP) and its customers.",CLD,Process,"Does the organization formally document a Customer Responsibility Matrix (CRM), delineating assigned responsibilities for controls between the Cloud Service Provider (CSP) and its customers?",8,Identify,No,No,No,SCF
CLD-06.2,Multi-Tenant Event Logging Capabilities,"Mechanisms exist to ensure Multi-Tenant Service Providers (MTSP) facilitate security event logging capabilities for its customers that are consistent with applicable statutory, regulatory and/or contractual obligations.",CLD,Process,"Does the organization ensure Multi-Tenant Service Providers (MTSP) facilitate security event logging capabilities for its customers that are consistent with applicable statutory, regulatory and/or contractual obligations?",8,Identify,No,No,No,SCF
CLD-06.3,Multi-Tenant Forensics Capabilities,Mechanisms exist to ensure Multi-Tenant Service Providers (MTSP) facilitate prompt forensic investigations in the event of a suspected or confirmed security incident.,CLD,Process,Does the organization ensure Multi-Tenant Service Providers (MTSP) facilitate prompt forensic investigations in the event of a suspected or confirmed security incident?,8,Identify,No,No,No,SCF
CLD-06.4,Multi-Tenant Incident Response Capabilities,"Mechanisms exist to ensure Multi-Tenant Service Providers (MTSP) facilitate prompt response to suspected or confirmed security incidents and vulnerabilities, including timely notification to affected customers.",CLD,Process,"Does the organization ensure Multi-Tenant Service Providers (MTSP) facilitate prompt response to suspected or confirmed security incidents and vulnerabilities, including timely notification to affected customers?",8,Identify,No,No,No,SCF
CLD-07,Data Handling & Portability,"Mechanisms exist to ensure cloud providers use secure protocols for the import, export and management of data in cloud-based services. ",CLD,Technology,"Does the organization ensure cloud providers use secure protocols for the import, export and management of data in cloud-based services? ",4,Protect,No,No,No,SCF
CLD-08,Standardized Virtualization Formats ,Mechanisms exist to ensure interoperability by requiring cloud providers to use industry-recognized formats and provide documentation of custom changes for review.,CLD,Technology,Does the organization ensure interoperability by requiring cloud providers to use industry-recognized formats and provide documentation of custom changes for review?,4,Protect,No,No,No,SCF
CLD-09,"Geolocation Requirements for Processing, Storage and Service Locations","Mechanisms exist to control the location of cloud processing/storage based on business requirements that includes statutory, regulatory and contractual obligations. ",CLD,Process,"Does the organization control the location of cloud processing/storage based on business requirements that includes statutory, regulatory and contractual obligations? ",10,Protect,No,No,No,SCF
CLD-10,Sensitive Data In Public Cloud Providers,Mechanisms exist to limit and manage the storage of sensitive/regulated data in public cloud providers. ,CLD,Data,Does the organization limit and manage the storage of sensitive/regulated data in public cloud providers? ,6,Protect,No,No,No,SCF
CLD-11,Cloud Access Security Broker (CASB),"Mechanisms exist to utilize a Cloud Access Security Broker (CASB), or similar technology, to provide boundary protection and monitoring functions that both provide access to the cloud and protect the organization from misuse of cloud resources.",CLD,Technology,"Does the organization utilize a Cloud Access Security Broker (CASB), or similar technology, to provide boundary protection and monitoring functions that both provide access to the cloud and protect the organization from misuse of cloud resources?",7,Protect,No,No,No,SCF
CLD-12,Side Channel Attack Prevention,"Mechanisms exist to prevent ""side channel attacks"" when using a Content Delivery Network (CDN) by restricting access to the origin server's IP address to the CDN and an authorized management network.",CLD,Technology,"Does the organization prevent ""side channel attacks"" when using a Content Delivery Network (CDN) by restricting access to the origin server's IP address to the CDN and an authorized management network?",3,Protect,No,No,No,SCF
CLD-13,"Hosted Systems, Applications & Services","Mechanisms exist to specify applicable cybersecurity & data protection controls that must be implemented on external systems, consistent with the contractual obligations established with the External Service Providers (ESP) owning, operating and/or maintaining external systems, applications and/or services.",CLD,Technology,"Does the organization specify applicable cybersecurity & data protection controls that must be implemented on external systems, consistent with the contractual obligations established with the External Service Providers (ESP) owning, operating and/or maintaining external systems, applications and/or services?",9,Protect,No,No,No,SCF
CLD-13.1,"Authorized Individuals For Hosted Systems, Applications & Services","Mechanisms exist to authorize specified individuals to access External Service Providers (ESP) owned, operated and/or maintained external systems, applications and/or services.",CLD,Process,"Does the organization authorize specified individuals to access External Service Providers (ESP) owned, operated and/or maintained external systems, applications and/or services?",9,Protect,No,No,No,SCF
CLD-13.2,"Sensitive/Regulated Data On Hosted Systems, Applications & Services","Mechanisms exist to define formal processes to store, process and/or transmit sensitive/regulated data using External Service Providers (ESP) owned, operated and/or maintained external systems, applications and/or services , in accordance with all applicable statutory, regulatory and/or contractual obligations.",CLD,Process,"Does the organization define formal processes to store, process and/or transmit sensitive/regulated data using External Service Providers (ESP) owned, operated and/or maintained external systems, applications and/or services , in accordance with all applicable statutory, regulatory and/or contractual obligations?",9,Protect,No,No,No,SCF
CLD-14,"Prohibition On Unverified Hosted Systems, Applications & Services","Mechanisms exist to prohibit access to, or usage of, hosted systems, applications and/or services until applicable cybersecurity & data protection control implementation is verified.",CLD,Technology,"Does the organization prohibit access to, or usage of, hosted systems, applications and/or services until applicable cybersecurity & data protection control implementation is verified?",8,Protect,No,No,No,SCF
CPL-01,"Statutory, Regulatory & Contractual Compliance ","Mechanisms exist to facilitate the identification and implementation of relevant statutory, regulatory and contractual controls.",CPL,Process,"Does the organization facilitate the identification and implementation of relevant statutory, regulatory and contractual controls?",10,Govern,No,No,No,SCF
CPL-01.1,Non-Compliance Oversight,"Mechanisms exist to document and review instances of non-compliance with statutory, regulatory and/or contractual obligations to develop appropriate risk mitigation actions.",CPL,Process,"Does the organization document and review instances of non-compliance with statutory, regulatory and/or contractual obligations to develop appropriate risk mitigation actions?",9,Respond,No,No,No,SCF
CPL-01.2,Compliance Scope,"Mechanisms exist to document and validate the scope of cybersecurity & data privacy controls that are determined to meet statutory, regulatory and/or contractual compliance obligations.",CPL,Process,"Does the organization document and validate the scope of cybersecurity & data privacy controls that are determined to meet statutory, regulatory and/or contractual compliance obligations?",10,Identify,No,No,No,SCF
CPL-01.3,Ability To Demonstrate Conformity,"Mechanisms exist to ensure the organization is able to demonstrate conformity with applicable cybersecurity and data protection laws, regulations and/or contractual obligations.",CPL,Process,"Does the organization ensure it is able to demonstrate conformity with applicable cybersecurity and data protection laws, regulations and/or contractual obligations?",8,Protect,No,No,No,SCF
CPL-01.4,Conformity Assessment,"Mechanisms exist to conduct assessments to demonstrate conformity with applicable cybersecurity and data protection laws, regulations and/or contractual obligations.",CPL,Process,"Does the organization conduct assessments to demonstrate conformity with applicable cybersecurity and data protection laws, regulations and/or contractual obligations?",9,Govern,Yes,No,No,SCF
CPL-01.5,Declaration of Conformity,"Mechanisms exist to generate a declaration of conformity for each conformity assessment, where the document:
(1) Is concise;
(2) Unambiguously reflects the current status;
(3) Is physically or electronically signed; and
(4) Where possible, is machine readable.",CPL,Process,"Does the organization generate a declaration of conformity for each conformity assessment, where the document:
(1) Is concise;
(2) Unambiguously reflects the current status;
(3) Is physically or electronically signed; and
(4) Where possible, is machine readable?",1,Govern,Yes,No,No,SCF
CPL-02,Cybersecurity & Data Protection Controls Oversight ,Mechanisms exist to provide a cybersecurity & data protection controls oversight function that reports to the organization's executive leadership.,CPL,Process,Does the organization provide a cybersecurity & data protection controls oversight function that reports to its executive leadership?,10,Detect,No,No,No,SCF
CPL-02.1,Internal Audit Function,Mechanisms exist to implement an internal audit function that is capable of providing senior organization management with insights into the appropriateness of the organization's technology and information governance processes.,CPL,Process,Does the organization implement an internal audit function that is capable of providing senior organization management with insights into the appropriateness of its technology and information governance processes?,5,Detect,No,No,No,SCF
CPL-02.2,Periodic Audits,"Mechanisms exist to conduct periodic audits of cybersecurity & data protection controls to evaluate conformity with the organization's documented policies, standards and procedures.",CPL,Process,"Does the organization conduct periodic audits of cybersecurity & data protection controls to evaluate conformity with its documented policies, standards and procedures?",8,Detect,No,No,No,SCF
CPL-02.3,Corrective Action,"Mechanisms exist to take corrective action to remediate instances of non-conformity with applicable statutory, regulatory, and/or contractual compliance obligations.",CPL,Process,"Does the organization take corrective action to remediate instances of non-conformity with applicable statutory, regulatory, and/or contractual compliance obligations?",7,Govern,Yes,No,No,SCF
CPL-03,Cybersecurity & Data Protection Assessments ,"Mechanisms exist to regularly review processes and documented procedures to ensure conformity with the organization's cybersecurity & data protection policies, standards and other applicable requirements.",CPL,Process,"Does the organization regularly review processes and documented procedures to ensure conformity with the organization's cybersecurity & data protection policies, standards and other applicable requirements?",10,Detect,No,No,No,SCF
CPL-03.1,Independent Assessors ,"Mechanisms exist to utilize independent assessors to evaluate cybersecurity & data protection controls at planned intervals or when the system, service or project undergoes significant changes.",CPL,Process,"Does the organization utilize independent assessors to evaluate cybersecurity & data protection controls at planned intervals or when the system, service or project undergoes significant changes?",6,Detect,No,No,No,SCF
CPL-03.2,Functional Review Of Cybersecurity & Data Protection Controls ,Mechanisms exist to regularly review technology assets for adherence to the organization's cybersecurity & data protection policies and standards. ,CPL,Process,Does the organization regularly review technology assets for adherence to its cybersecurity & data protection policies and standards? ,8,Detect,No,No,No,SCF
CPL-03.3,Assessor Access,"Mechanisms exist to grant assessors minimum necessary access to conduct conformity assessments, including:
(1) Logical access to design, development, production, inspection and testing artifacts; and 
(2) Physical access to facilities.",CPL,Process,"Does the organization grant assessors minimum necessary access to conduct conformity assessments, including:
(1) Logical access to design, development, production, inspection and testing artifacts; and 
(2) Physical access to facilities?",7,Govern,Yes,No,No,SCF
CPL-04,Audit Activities ,Mechanisms exist to thoughtfully plan audits by including input from operational risk and compliance partners to minimize the impact of audit-related activities on business operations.,CPL,Process,Does the organization thoughtfully plan audits by including input from operational risk and compliance partners to minimize the impact of audit-related activities on business operations?,5,Identify,No,No,No,SCF
CPL-05,Legal Assessment of Investigative Inquires,"Mechanisms exist to determine whether a government agency has an applicable and valid legal basis to request data from the organization and what further steps need to be taken, if necessary.",CPL,Process,"Does the organization determine whether a government agency has an applicable and valid legal basis to request data from the organization and what further steps need to be taken, if necessary?",2,Respond,No,No,No,SCF
CPL-05.1,Investigation Request Notifications,"Mechanisms exist to notify customers about investigation request notifications, unless the applicable legal basis for a government agency's action prohibits notification (e.g., potential criminal prosecution).",CPL,Process,"Does the organization notify customers about investigation request notifications, unless the applicable legal basis for a government agency's action prohibits notification (e.g., potential criminal prosecution)?",2,Respond,No,No,No,SCF
CPL-05.2,Investigation Access Restrictions,"Mechanisms exist to support official investigations by provisioning government investigators with ""least privileges"" and ""least functionality"" to ensure that government investigators only have access to the data and systems needed to perform the investigation.",CPL,Process,"Does the organization support official investigations by provisioning government investigators with ""least privileges"" and ""least functionality"" to ensure that government investigators only have access to the data and systems needed to perform the investigation?",2,Protect,No,No,No,SCF
CPL-06,Government Surveillance,"Mechanisms exist to constrain the host government from having unrestricted and non-monitored access to the organization's systems, applications and services that could potentially violate other applicable statutory, regulatory and/or contractual obligations.",CPL,Process,"Does the organization constrain the host government from having unrestricted and non-monitored access to its systems, applications and services that could potentially violate other applicable statutory, regulatory and/or contractual obligations?",10,Protect,No,No,No,SCF
CPL-07,Grievances,Mechanisms exist to govern the intake and analysis of grievances related to the organization's cybersecurity and/or data protection practices.,CPL,Process,"Does the organization govern the intake, analysis, assignment and remediation of grievances related to its cybersecurity and/or data protection practices?",5,Respond,No,No,No,SCF
CPL-07.1,Grievance Response,Mechanisms exist to respond to legitimate grievances related to the organization's cybersecurity and/or data protection practices.,CPL,Process,Does the organization respond to legitimate grievances related to its cybersecurity and/or data protection practices?,5,Respond,No,No,No,SCF
CPL-08,Localized Representation,"Mechanisms exist to appoint localized representation with a physical presence in localities, as required by applicable laws and/or regulations.",CPL,Process,"Does the organization appoint localized representation with a physical presence in localities, as required by applicable laws and/or regulations?",2,Govern,Yes,No,No,SCF
CPL-08.1,Representative Powers,Mechanisms exist to contract localized representation to perform specified functions in regard to representing statutory and/or regulatory compliance matters.,CPL,Process,Does the organization contract localized representation to perform specified functions in regard to representing statutory and/or regulatory compliance matters?,2,Govern,Yes,No,No,SCF
CRY-01,Use of Cryptographic Controls ,Mechanisms exist to facilitate the implementation of cryptographic protections controls using known public standards and trusted cryptographic technologies.,CRY,Data,Does the organization facilitate the implementation of cryptographic protections controls using known public standards and trusted cryptographic technologies?,10,Govern,No,No,No,SCF
CRY-01.1,Alternate Physical Protection ,Cryptographic mechanisms exist to prevent unauthorized disclosure of information as an alternative to physical safeguards. ,CRY,Technology,Are cryptographic mechanisms utilized to prevent unauthorized disclosure of information as an alternative to physical safeguards? ,5,Protect,No,No,No,SCF
CRY-01.2,Export-Controlled Cryptography,Mechanisms exist to address the exporting of cryptographic technologies in compliance with relevant statutory and regulatory requirements.,CRY,Process,Does the organization address the exporting of cryptographic technologies in compliance with relevant statutory and regulatory requirements?,5,Protect,No,No,No,SCF
CRY-01.3,Pre/Post Transmission Handling,Cryptographic mechanisms exist to ensure the confidentiality and integrity of information during preparation for transmission and during reception.,CRY,Technology,Are cryptographic mechanisms utilized to ensure the confidentiality and integrity of information during preparation for transmission and during reception?,5,Protect,No,No,No,SCF
CRY-01.4,Conceal / Randomize Communications,Cryptographic mechanisms exist to conceal or randomize communication patterns.,CRY,Technology,Are cryptographic mechanisms utilized to conceal or randomize communication patterns?,5,Protect,No,No,No,SCF
CRY-01.5,Cryptographic Cipher Suites and Protocols Inventory,"Mechanisms exist to identify, document and review deployed cryptographic cipher suites and protocols to proactively respond to industry trends regarding the continued viability of utilized cryptographic cipher suites and protocols.",CRY,Process,"Does the organization identify, document and review deployed cryptographic cipher suites and protocols to proactively respond to industry trends regarding the continued viability of utilized cryptographic cipher suites and protocols?",9,Protect,No,No,No,SCF
CRY-02,Cryptographic Module Authentication,Automated mechanisms exist to enable systems to authenticate to a cryptographic module.,CRY,Technology,Does the organization use automated mechanisms to enable systems to authenticate to a cryptographic module?,8,Protect,No,No,No,SCF
CRY-03,Transmission Confidentiality ,Cryptographic mechanisms exist to protect the confidentiality of data being transmitted. ,CRY,Data,Are cryptographic mechanisms utilized to protect the confidentiality of data being transmitted? ,10,Protect,No,No,No,SCF
CRY-04,Transmission Integrity ,Cryptographic mechanisms exist to protect the integrity of data being transmitted. ,CRY,Data,Are cryptographic mechanisms utilized to protect the integrity of data being transmitted? ,10,Protect,No,No,No,SCF
CRY-05,Encrypting Data At Rest ,Cryptographic mechanisms exist to prevent unauthorized disclosure of data at rest. ,CRY,Data,Are cryptographic mechanisms utilized to prevent unauthorized disclosure of data at rest? ,10,Protect,No,No,No,SCF
