control_id,control_name,control_text,domain_identifier,pptdf_scope,control_question,relative_weighting,nist_csf_function,is_new_control,is_mcr,is_dsr,control_type
AAT-01,Artificial Intelligence (AI) & Autonomous Technologies Governance,"Mechanisms exist to ensure policies, processes, procedures and practices related to the mapping, measuring and managing of Artificial Intelligence (AI) and Autonomous Technologies (AAT)-related risks are in place, transparent and implemented effectively.",AAT,Process,"Does the organization ensure policies, processes, procedures and practices related to the mapping, measuring and managing of Artificial Intelligence (AI) and Autonomous Technologies (AAT)-related risks are in place, transparent and implemented effectively?",10,Govern,No,No,No,SCF
AAT-01.1,AI & Autonomous Technologies-Related Legal Requirements Definition,"Mechanisms exist to identify, understand, document and manage applicable statutory and regulatory requirements for Artificial Intelligence (AI) and Autonomous Technologies (AAT).",AAT,Process,"Does the organization identify, understand, document and manage applicable statutory and regulatory requirements for Artificial Intelligence (AI) and Autonomous Technologies (AAT)?",8,Govern,No,No,No,SCF
AAT-01.2,Trustworthy AI & Autonomous Technologies,"Mechanisms exist to ensure Artificial Intelligence (AI) and Autonomous Technologies (AAT) are designed to be reliable, safe, fair, secure, resilient, transparent, explainable and data privacy-enhanced to minimize emergent properties or unintended consequences.",AAT,Process,"Does the organization ensure Artificial Intelligence (AI) and Autonomous Technologies (AAT) are designed to be reliable, safe, fair, secure, resilient, transparent, explainable and data privacy-enhanced to minimize emergent properties or unintended consequences?",10,Protect,No,No,No,SCF
AAT-01.3,AI & Autonomous Technologies Value Sustainment,Mechanisms exist to sustain the value of deployed Artificial Intelligence (AI) and Autonomous Technologies (AAT).,AAT,Process,Does the organization sustain the value of deployed Artificial Intelligence (AI) and Autonomous Technologies (AAT)?,1,Identify,No,No,No,SCF
AAT-02,Situational Awareness of AI & Autonomous Technologies,Mechanisms exist to develop and maintain an inventory of Artificial Intelligence (AI) and Autonomous Technologies (AAT) (internal and third-party).,AAT,Process,Does the organization develop and maintain an inventory of Artificial Intelligence (AI) and Autonomous Technologies (AAT) (internal and third-party)?,9,Identify,No,No,No,SCF
AAT-02.1,AI & Autonomous Technologies Risk Mapping,"Mechanisms exist to identify Artificial Intelligence (AI) and Autonomous Technologies (AAT) in use and map those components to potential legal risks, including statutory and regulatory compliance requirements.",AAT,Process,"Does the organization identify Artificial Intelligence (AI) and Autonomous Technologies (AAT) in use and map those components to potential legal risks, including statutory and regulatory compliance requirements?",9,Identify,No,No,No,SCF
AAT-02.2,AI & Autonomous Technologies Internal Controls,Mechanisms exist to identify and document internal cybersecurity & data privacy controls for Artificial Intelligence (AI) and Autonomous Technologies (AAT).,AAT,Process,Does the organization identify and document internal cybersecurity & data privacy controls for Artificial Intelligence (AI) and Autonomous Technologies (AAT)?,9,Identify,No,No,No,SCF
AAT-02.3,Adequate Protections For AI & Autonomous Technologies,Mechanisms exist to ensure Artificial Intelligence (AI) and Autonomous Technologies (AAT) include reasonable cybersecurity and data protections that are commensurate with assessed risks and threats.,AAT,Process,Does the organization ensure Artificial Intelligence (AI) and Autonomous Technologies (AAT) include reasonable cybersecurity and data protections that are commensurate with assessed risks and threats?,10,Govern,Yes,No,No,SCF
AAT-03,AI & Autonomous Technologies Context Definition,"Mechanisms exist to establish and document the context surrounding Artificial Intelligence (AI) and Autonomous Technologies (AAT), including:
(1) Intended purposes;
(2) Potentially beneficial uses;
(3) Context-specific laws and regulations;
(4) Norms and expectations; and
(5) Prospective settings in which the system(s) will be deployed.",AAT,Process,"Does the organization establish and document the context surrounding Artificial Intelligence (AI) and Autonomous Technologies (AAT), including:
 (1) Intended purposes;
 (2) Potentially beneficial uses;
 (3) Context-specific laws and regulations;
 (4) Norms and expectations; and
 (5) Prospective settings in which the system(s) will be deployed?",8,Identify,No,No,No,SCF
AAT-03.1,AI & Autonomous Technologies Mission and Goals Definition,Mechanisms exist to define and document the organization's mission and defined goals for Artificial Intelligence (AI) and Autonomous Technologies (AAT).,AAT,Process,Does the organization define and document its mission and defined goals for Artificial Intelligence (AI) and Autonomous Technologies (AAT)?,8,Identify,No,No,No,SCF
AAT-04,AI & Autonomous Technologies Business Case,"Mechanisms exist to benchmark capabilities, targeted usage, goals and expected benefits and costs of Artificial Intelligence (AI) and Autonomous Technologies (AAT).",AAT,Process,"Does the organization benchmark capabilities, targeted usage, goals and expected benefits and costs of Artificial Intelligence (AI) and Autonomous Technologies (AAT)?",8,Identify,No,No,No,SCF
AAT-04.1,AI & Autonomous Technologies Potential Benefits Analysis,Mechanisms exist to assess the potential benefits of proposed Artificial Intelligence (AI) and Autonomous Technologies (AAT).,AAT,Process,Does the organization assess the potential benefits of proposed Artificial Intelligence (AI) and Autonomous Technologies (AAT)?,2,Identify,No,No,No,SCF
AAT-04.2,AI & Autonomous Technologies Potential Costs Analysis,"Mechanisms exist to assess potential costs, including non-monetary costs, resulting from expected or realized Artificial Intelligence (AI) and Autonomous Technologies (AAT)-related errors or system functionality and trustworthiness.",AAT,Process,"Does the organization assess potential costs, including non-monetary costs, resulting from expected or realized Artificial Intelligence (AI) and Autonomous Technologies (AAT)-related errors or system functionality and trustworthiness?",2,Identify,No,No,No,SCF
AAT-04.3,AI & Autonomous Technologies Targeted Application Scope,Mechanisms exist to specify and document the targeted application scope of the proposed use and operation of Artificial Intelligence (AI) and Autonomous Technologies (AAT).,AAT,Process,Does the organization specify and document the targeted application scope of the proposed use and operation of Artificial Intelligence (AI) and Autonomous Technologies (AAT)?,8,Identify,No,No,No,SCF
AAT-04.4,AI & Autonomous Technologies Cost / Benefit Mapping,"Mechanisms exist to map risks and benefits for all components of Artificial Intelligence (AI) and Autonomous Technologies (AAT), including third-party software and data.",AAT,Process,"Does the organization map risks and benefits for all components of Artificial Intelligence (AI) and Autonomous Technologies (AAT), including third-party software and data?",2,Identify,No,No,No,SCF
AAT-05,AI & Autonomous Technologies Training,Mechanisms exist to ensure personnel and external stakeholders are provided with position-specific risk management training for Artificial Intelligence (AI) and Autonomous Technologies (AAT).,AAT,People,Does the organization ensure personnel and external stakeholders are provided with position-specific risk management training for Artificial Intelligence (AI) and Autonomous Technologies (AAT)?,5,Identify,No,No,No,SCF
AAT-06,AI & Autonomous Technologies Fairness & Bias,"Mechanisms exist to prevent Artificial Intelligence (AI) and Autonomous Technologies (AAT) from unfairly identifying, profiling and/or statistically singling out a segmented population defined by race, religion, gender identity, national origin, religion, disability or any other politically-charged identifier.",AAT,Process,"Does the organization prevent Artificial Intelligence (AI) and Autonomous Technologies (AAT) from unfairly identifying, profiling and/or statistically singling out a segmented population defined by race, religion, gender identity, national origin, religion, disability or any other politically-charged identifier?",9,Identify,No,No,No,SCF
AAT-07,AI & Autonomous Technologies Risk Management Decisions,"Mechanisms exist to leverage decision makers from a diversity of demographics, disciplines, experience, expertise and backgrounds for mapping, measuring and managing Artificial Intelligence (AI) and Autonomous Technologies (AAT)-related risks.",AAT,Process,"Does the organization leverage decision makers from a diversity of demographics, disciplines, experience, expertise and backgrounds for mapping, measuring and managing Artificial Intelligence (AI) and Autonomous Technologies (AAT)-related risks?",10,Identify,No,No,No,SCF
AAT-07.1,AI & Autonomous Technologies Impact Assessment,"Mechanisms exist to assess the impact(s) of proposed Artificial Intelligence (AI) and Autonomous Technologies (AAT) on individuals, groups, communities, organizations and society (e.g., Fundamental Rights Impact Assessment (FRIA)).",AAT,Process,"Does the organization assess the impact(s) of proposed Artificial Intelligence (AI) and Autonomous Technologies (AAT) on individuals, groups, communities, organizations and society (e.g., Fundamental Rights Impact Assessment (FRIA))?",8,Identify,No,No,No,SCF
AAT-07.2,AI & Autonomous Technologies Likelihood & Impact Risk Analysis,Mechanisms exist to define the potential likelihood and impact of each identified risk based on expected use and past uses of Artificial Intelligence (AI) and Autonomous Technologies (AAT) in similar contexts.,AAT,Process,Does the organization define the potential likelihood and impact of each identified risk based on expected use and past uses of Artificial Intelligence (AI) and Autonomous Technologies (AAT) in similar contexts?,10,Identify,No,No,No,SCF
AAT-07.3,AI & Autonomous Technologies Continuous Improvements,Mechanisms exist to continuously improve Artificial Intelligence (AI) and Autonomous Technologies (AAT) capabilities to maximize benefits and minimize negative impacts associated with AAT.,AAT,Process,Does the organization continuously improve Artificial Intelligence (AI) and Autonomous Technologies (AAT) capabilities to maximize benefits and minimize negative impacts associated with AAT?,8,Identify,No,No,No,SCF
AAT-08,Assigned Responsibilities for AI & Autonomous Technologies,"Mechanisms exist to define and differentiate roles and responsibilities for:
(1) Artificial Intelligence (AI) and Autonomous Technologies (AAT) configurations; and
(2) Oversight of AAT systems.",AAT,Process,"Does the organization define and differentiate roles and responsibilities for:
(1) Artificial Intelligence (AI) and Autonomous Technologies (AAT) configurations; and
(2) Oversight of AAT systems?",9,Identify,No,No,No,SCF
AAT-09,AI & Autonomous Technologies Risk Profiling,"Mechanisms exist to document the risks and potential impacts of Artificial Intelligence (AI) and Autonomous Technologies (AAT) that are:
(1) Designed;
(2) Developed;
(3) Deployed;
(4) Evaluated; and/or
(5) Used.",AAT,Process,"Does the organization document the risks and potential impacts of Artificial Intelligence (AI) and Autonomous Technologies (AAT) that are:
(1) Designed;
(2) Developed;
(3) Deployed;
(4) Evaluated; and/or
(5) Used?",9,Identify,No,No,No,SCF
AAT-09.1,AI & Autonomous Technologies High Risk Designations,"Mechanisms exist to designate Artificial Intelligence (AI) and Autonomous Technologies (AAT) ""High Risk"" if one(1), or more, of the following criteria are met:
(1) AAT is used as a safety component of a product or service;
(2) AAT poses a significant risk of harm to an individual's health, safety or fundamental rights; and/or
(3) AAT materially influences the outcome of an individual's decision making.",AAT,Process,"Does the organization designate Artificial Intelligence (AI) and Autonomous Technologies (AAT) ""High Risk"" if one(1), or more, of the following criteria are met:
(1) AAT is used as a safety component of a product or service;
(2) AAT poses a significant risk of harm to an individual's health, safety or fundamental rights; and/or
(3) AAT materially influences the outcome of an individual's decision making?",7,Identify,Yes,No,No,SCF
AAT-10,"Artificial Intelligence Test, Evaluation, Validation & Verification (AI TEVV) ","Mechanisms exist to implement Artificial Intelligence Test, Evaluation, Validation & Verification (AI TEVV) practices to enable Artificial Intelligence (AI) and Autonomous Technologies (AAT)-related security, resilience and compliance-related conformity testing throughout the lifecycle of the AAT.",AAT,Process,"Does the organization implement Artificial Intelligence Test, Evaluation, Validation & Verification (AI TEVV) practices to enable Artificial Intelligence (AI) and Autonomous Technologies (AAT)-related security, resilience and compliance-related conformity testing throughout the lifecycle of the AAT?",10,Detect,No,No,No,SCF
AAT-10.1,AI TEVV Trustworthiness Assessment,"Mechanisms exist to evaluate Artificial Intelligence (AI) and Autonomous Technologies (AAT) for trustworthy behavior and operation including security, anonymization and disaggregation of captured and stored data for approved purposes.",AAT,Process,"Does the organization evaluate Artificial Intelligence (AI) and Autonomous Technologies (AAT) for trustworthy behavior and operation including security, anonymization and disaggregation of captured and stored data for approved purposes?",10,Detect,No,No,No,SCF
AAT-10.10,AI TEVV Results Evaluation,"Mechanisms exist to evaluate the results of Artificial Intelligence Test, Evaluation, Validation & Verification (AI TEVV) to determine the viability of the proposed Artificial Intelligence (AI) and Autonomous Technologies (AAT).",AAT,Process,"Does the organization evaluate the results of Artificial Intelligence Test, Evaluation, Validation & Verification (AI TEVV) to determine the viability of the proposed Artificial Intelligence (AI) and Autonomous Technologies (AAT)?",10,Detect,No,No,No,SCF
AAT-10.11,AI TEVV Effectiveness,"Mechanisms exist to evaluate the effectiveness of the processes utilized to perform Artificial Intelligence Test, Evaluation, Validation & Verification (AI TEVV).",AAT,Process,"Does the organization evaluate the effectiveness of the processes utilized to perform Artificial Intelligence Test, Evaluation, Validation & Verification (AI TEVV)?",5,Detect,No,No,No,SCF
AAT-10.12,AI TEVV Comparable Deployment Settings,Mechanisms exist to evaluate Artificial Intelligence (AI) and Autonomous Technologies (AAT)-related performance or the assurance criteria demonstrated for conditions similar to deployment settings.,AAT,Process,Does the organization evaluate Artificial Intelligence (AI) and Autonomous Technologies (AAT)-related performance or the assurance criteria demonstrated for conditions similar to deployment settings?,5,Identify,No,No,No,SCF
AAT-10.13,AI TEVV Post-Deployment Monitoring,Mechanisms exist to proactively and continuously monitor deployed Artificial Intelligence (AI) and Autonomous Technologies (AAT).,AAT,Process,Does the organization proactively and continuously monitor deployed Artificial Intelligence (AI) and Autonomous Technologies (AAT)?,9,Detect,No,No,No,SCF
AAT-10.14,Updating AI & Autonomous Technologies,Mechanisms exist to integrate continual improvements for deployed Artificial Intelligence (AI) and Autonomous Technologies (AAT).,AAT,Process,Does the organization integrate continual improvements for deployed Artificial Intelligence (AI) and Autonomous Technologies (AAT)?,9,Identify,No,No,No,SCF
AAT-10.15,AI TEVV Reporting,"Mechanisms exist to report the status and results of Artificial Intelligence Test, Evaluation, Validation & Verification (AI TEVV) to relevant stakeholders, including governing bodies, as required.",AAT,Process,"Does the organization report the status and results of Artificial Intelligence Test, Evaluation, Validation & Verification (AI TEVV) to relevant stakeholders, including governing bodies, as required?",5,Protect,Yes,No,No,SCF
AAT-10.16,AI TEVV Empirically Validated Methods,Mechanisms exist to evaluate claims of Artificial Intelligence (AI) and Autonomous Technologies (AAT) model capabilities using empirically validated methods.,AAT,Process,Does the organization evaluate claims of Artificial Intelligence (AI) and Autonomous Technologies (AAT) model capabilities using empirically validated methods?,1,Protect,Yes,No,No,SCF
AAT-10.17,AI TEVV Benchmarking Content Provenance,Mechanisms exist to benchmark the verifiable lineage and origin of content used by Artificial Intelligence (AI) and Autonomous Technologies (AAT) according to industry-recognized standards.,AAT,Process,Does the organization benchmark the verifiable lineage and origin of content used by Artificial Intelligence (AI) and Autonomous Technologies (AAT) according to industry -recognized standards?,7,Protect,Yes,No,No,SCF
AAT-10.18,AI TEVV Model Collapse Mitigations,"Mechanisms exist to mitigate concerns of model collapse by:
(1) Assessing the proportion of synthetic to non-synthetic training data; and
(2) Verifying training data is not overly homogenous or Artificial Intelligence (AI) and Autonomous Technologies (AAT) system-produced.",AAT,Process,"Does the organization mitigate concerns of model collapse by:
(1) Assessing the proportion of synthetic to non-synthetic training data; and
(2) Verifying training data is not overly homogenous or Artificial Intelligence (AI) and Autonomous Technologies (AAT) system-produced?",8,Protect,Yes,No,No,SCF
AAT-10.2,AI TEVV Tools,"Mechanisms exist to document test sets, metrics and details about the tools used during Artificial Intelligence Test, Evaluation, Validation & Verification (AI TEVV) practices.",AAT,Process,"Does the organization document test sets, metrics and details about the tools used during Artificial Intelligence Test, Evaluation, Validation & Verification (AI TEVV) practices?",7,Detect,No,No,No,SCF
AAT-10.3,AI TEVV Trustworthiness Demonstration,"Mechanisms exist to demonstrate the Artificial Intelligence (AI) and Autonomous Technologies (AAT) to be deployed are:
(1) Valid;
(2) Reliable; and
(3) Operate as intended, based on approved designs.",AAT,Process,"Does the organization demonstrate the Artificial Intelligence (AI) and Autonomous Technologies (AAT) to be deployed are:
(1) Valid;
(2) Reliable; and
(3) Operate as intended, based on approved designs?",9,Detect,No,No,No,SCF
AAT-10.4,AI TEVV Safety Demonstration,"Mechanisms exist to demonstrate the Artificial Intelligence (AI) and Autonomous Technologies (AAT) to be deployed are safe, residual risk does not exceed the organization's risk tolerance and can fail safely, particularly if made to operate beyond its knowledge limits.",AAT,Process,"Does the organization demonstrate the Artificial Intelligence (AI) and Autonomous Technologies (AAT) to be deployed are safe, residual risk does not exceed its risk tolerance and can fail safely, particularly if made to operate beyond its knowledge limits?",10,Detect,No,No,No,SCF
AAT-10.5,AI TEVV Security & Resiliency Assessment,Mechanisms exist to evaluate the security and resilience of Artificial Intelligence (AI) and Autonomous Technologies (AAT) to be deployed.,AAT,Process,Does the organization evaluate the security and resilience of Artificial Intelligence (AI) and Autonomous Technologies (AAT) to be deployed?,6,Detect,No,No,No,SCF
AAT-10.6,AI TEVV Transparency & Accountability Assessment,Mechanisms exist to examine risks associated with transparency and accountability of Artificial Intelligence (AI) and Autonomous Technologies (AAT) to be deployed.,AAT,Process,Does the organization examine risks associated with transparency and accountability of Artificial Intelligence (AI) and Autonomous Technologies (AAT) to be deployed?,7,Detect,No,No,No,SCF
AAT-10.7,AI TEVV Privacy Assessment,Mechanisms exist to examine the data privacy risk of Artificial Intelligence (AI) and Autonomous Technologies (AAT) to be deployed.,AAT,Process,Does the organization examine the data privacy risk of Artificial Intelligence (AI) and Autonomous Technologies (AAT) to be deployed?,9,Detect,No,No,No,SCF
AAT-10.8,AI TEVV Fairness & Bias Assessment,Mechanisms exist to examine fairness and bias of Artificial Intelligence (AI) and Autonomous Technologies (AAT) to be deployed.,AAT,Process,Does the organization examine fairness and bias of Artificial Intelligence (AI) and Autonomous Technologies (AAT) to be deployed?,9,Detect,No,No,No,SCF
AAT-10.9,AI & Autonomous Technologies Model Validation,Mechanisms exist to validate the Artificial Intelligence (AI) and Autonomous Technologies (AAT) model.,AAT,Process,Does the organization validate the Artificial Intelligence (AI) and Autonomous Technologies (AAT) model?,5,Detect,No,No,No,SCF
AAT-11,Robust Stakeholder Engagement for AI & Autonomous Technologies,"Mechanisms exist to compel ongoing engagement with relevant Artificial Intelligence (AI) and Autonomous Technologies (AAT) stakeholders to encourage feedback about positive, negative and unanticipated impacts.",AAT,Process,"Does the organization compel ongoing engagement with relevant Artificial Intelligence (AI) and Autonomous Technologies (AAT) stakeholders to encourage feedback about positive, negative and unanticipated impacts?",9,Protect,No,No,No,SCF
AAT-11.1,AI & Autonomous Technologies Stakeholder Feedback Integration,"Mechanisms exist to regularly collect, consider, prioritize and integrate risk-related feedback from those external to the team that developed or deployed Artificial Intelligence (AI) and Autonomous Technologies (AAT).",AAT,Process,"Does the organization regularly collect, consider, prioritize and integrate risk-related feedback from those external to the team that developed or deployed Artificial Intelligence (AI) and Autonomous Technologies (AAT)?",9,Protect,No,No,No,SCF
AAT-11.2,AI & Autonomous Technologies Ongoing Assessments,Mechanisms exist to conduct regular assessments of Artificial Intelligence (AI) and Autonomous Technologies (AAT) with independent assessors and stakeholders not involved in the development of the AAT.,AAT,Process,Does the organization conduct regular assessments of Artificial Intelligence (AI) and Autonomous Technologies (AAT) with independent assessors and stakeholders not involved in the development of the AAT?,9,Protect,No,No,No,SCF
AAT-11.3,AI & Autonomous Technologies End User Feedback,Mechanisms exist to collect and integrate feedback from end users and impacted communities into Artificial Intelligence (AI) and Autonomous Technologies (AAT)-related system evaluation metrics.,AAT,Process,Does the organization collect and integrate feedback from end users and impacted communities into Artificial Intelligence (AI) and Autonomous Technologies (AAT)-related system evaluation metrics?,7,Protect,No,No,No,SCF
AAT-11.4,AI & Autonomous Technologies Incident & Error Reporting,"Mechanisms exist to communicate Artificial Intelligence (AI) and Autonomous Technologies (AAT)-related incidents and/or errors to relevant stakeholders, including affected communities. ",AAT,Process,"Does the organization communicate Artificial Intelligence (AI) and Autonomous Technologies (AAT)-related incidents and/or errors to relevant stakeholders, including affected communities? ",9,Protect,No,No,No,SCF
AAT-12,AI & Autonomous Technologies Intellectual Property Infringement Protections,Mechanisms exist to prevent third-party Intellectual Property (IP) rights infringement by Artificial Intelligence (AI) and Autonomous Technologies (AAT).,AAT,Process,Does the organization prevent third-party Intellectual Property (IP) rights infringement by Artificial Intelligence (AI) and Autonomous Technologies (AAT)?,10,Protect,No,No,No,SCF
AAT-12.1,Data Source Identification,Mechanisms exist to identify and document data sources utilized in the training and/or operation of Artificial Intelligence and Autonomous Technologies (AAT).,AAT,Process,Does the organization identify and document data sources utilized in the training and/or operation of Artificial Intelligence and Autonomous Technologies (AAT)?,10,Govern,No,No,No,SCF
AAT-12.2,Data Source Integrity,"Mechanisms exist to protect the integrity of source data to prevent accidental contamination or malicious corruption (e.g., data poisoning) that could compromise the performance of Artificial Intelligence and Autonomous Technologies (AAT).",AAT,Data,"Does the organization protect the integrity of source data to prevent accidental contamination or malicious corruption (e.g., data poisoning) that could compromise the performance of Artificial Intelligence and Autonomous Technologies (AAT)?",10,Protect,No,No,No,SCF
AAT-12.3,Data Source Lineage & Origin Disclosure,"Mechanisms exist to ensure Artificial Intelligence and Autonomous Technologies (AAT) publicly disclose information with sufficient detail to assess:
(1) Content lineage; and 
(2) The origin of data used by the AAT.",AAT,Process,"Does the organization ensure Artificial Intelligence and Autonomous Technologies (AAT) publicly disclose information with sufficient detail to assess:
(1) Content lineage; and 
(2) The origin of data used by the AAT?",9,Protect,Yes,No,No,SCF
