node_id,duty_name,duty_type,legal_citation,duty_description,mandatory,applicable_to,penalty_for_violation,imposed_by_section_or_rule_id,regional_standard_regulation_id
DUTY-MINIMIZATION,Duty of Data Minimization,Data Minimization,§ 6-1-1308(1),"Controller shall limit collection of personal data to what is adequate, relevant, and reasonably necessary in relation to the purposes for which data is processed.",True,All controllers,Civil penalty up to $20000 per violation,SECTION-6-1-1308,CPA 1.0
DUTY-AVOID-SECONDARY-USE,Duty to Avoid Secondary Use,Purpose Limitation,§ 6-1-1308(4),"Controller shall not process personal data for purposes that are not reasonably necessary to, or compatible with, the disclosed purposes for which such personal data is processed, unless the controller obtains the consumer's consent.",True,All controllers processing personal data,Civil penalty up to $20000 per violation,SECTION-6-1-1308,CPA 1.0
DUTY-RESPOND-RIGHTS-REQUESTS,Duty to Respond to Rights Requests,Rights Response,§ 6-1-1307,"Controller shall respond to consumer rights requests within 45 days (extendable by 45 days with notice); provide an appeal process if request is denied; inform consumer of right to contact Attorney General if appeal is denied.",True,All controllers,Civil penalty up to $20000 per violation,SECTION-6-1-1307,CPA 1.0
DUTY-HONOR-OPT-OUT,Duty to Honor Universal Opt-Out,Opt-Out Compliance,§ 6-1-1306(1)(d) & Rule 5.01,"Controller shall honor universal opt-out mechanism signals (such as Global Privacy Control) as valid opt-out requests for targeted advertising and sales of personal data.",True,All controllers,Civil penalty up to $20000 per violation,SECTION-6-1-1306,CPA 1.0
DUTY-PROVIDE-NOTICE,Duty to Provide Privacy Notice,Transparency,§ 6-1-1308(1)(a) & Rule 8.01,"Controller shall provide clear and conspicuous privacy notice disclosing: categories of personal data collected; purposes of processing; whether data is shared or sold; consumer rights; and available opt-out mechanisms.",True,All controllers,Civil penalty up to $20000 per violation,SECTION-6-1-1308,CPA 1.0
DUTY-OBTAIN-CONSENT,Duty to Obtain Valid Consent,Consent,§ 6-1-1304(1) & Rule 7.03,"Controller shall obtain clear, affirmative, freely-given, specific, informed, and unambiguous consent for processing sensitive personal data; shall not use dark patterns or prohibited consent practices.",True,Controllers processing sensitive data,Civil penalty up to $20000 per violation,SECTION-6-1-1304,CPA 1.0