node_id,node_name,node_type,definition,official_description,applicable_to,organization_owner,version,status,key_features
glba_npi_001,Nonpublic Personal Information (NPI),Data Category,"Personally identifiable financial information about a consumer that is not publicly available, collected by financial institutions in connection with providing financial products or services. Core protected data category defining the scope of GLBA Financial Privacy Rule and Safeguards Rule protections.","GLBA defines NPI in Regulation P Section 1016.3 as personally identifiable financial information that is nonpublic. NPI encompasses three primary categories: (1) Information consumer provides to obtain financial product or service - applications and forms, loan applications, credit card applications, account opening documents, financial statements, employment information, income verification, Social Security number (SSN), date of birth, driver's license number, passport number, address, phone numbers, email addresses; (2) Information resulting from transactions involving financial product or service - account numbers, account balances, transaction history, payment history, credit card purchase history, check account activity, loan payment schedules, investment account holdings, mutual fund portfolios, wire transfer records, account interest rates, fees, overdraft records, ATM withdrawals; (3) Information otherwise obtained in connection with providing financial product or service - credit reports and credit scores, creditworthiness assessments, fraud risk scores, behavioral scoring, customer segmentation data and lists, marketing preference information, service usage patterns, financial condition analysis, employment verification records, benefit statements. NPI does NOT include: information lawfully available from public sources (government records, courthouse records, public registries, published directories, news articles, SEC filings, court documents); properly de-identified or aggregated data where individuals cannot be reasonably re-identified through reasonable efforts; information that has been effectively de-identified (Safe Harbor standard per HIPAA); information in contexts where no financial product/service relationship exists. Protection requirements apply whether NPI is structured data in databases, unstructured data in documents/emails/logs, backup copies, archived data, or temporary processing files. Includes metadata and system logs containing customer identifiers even if core data not present.","All financial institutions collecting, maintaining, using, or disclosing consumer financial information; Applies to all consumer relationships (one-time transactions) and customer relationships (ongoing); Applies to any person obtaining NPI (institution, service providers, third parties); Applies to nonpublic personal information in any form (digital, paper, email, voice recordings, video); Extends to NPI in possession of institution and in possession of service providers; Information subject to GLBA protection regardless of how created or obtained (directly from consumer or from third parties); All customer segments (retail, commercial, institutional); All product lines (deposits, lending, investments, insurance, payment services)","Financial institution as data controller responsible for GLBA compliance; Data Protection Officer or Privacy Officer for policy/governance; Chief Information Security Officer for protection mechanisms; Information Security team for technical safeguards; Operations teams for access controls; Service providers as data processors; Compliance and audit for verification; Board of Directors for governance oversight","Regulation P Section 1016.3; 16 CFR Part 313.3 (Privacy of Consumer Financial Information); 15 USC 6809 (GLBA Definitions Section); FTC guidance on NPI; Federal banking regulator guidance; Dodd-Frank Act Section 1093 (FAST Act amendments)","Active definition with no expiration; GLBA framework ongoing","Definition and Scope: Personally identifiable financial information (definition); Nonpublic (not lawfully in public domain); Requires connection to financial product or service; Includes both direct provider and transaction information; Includes derived/analyzed information; Three-part test: information provided, information resulting from transactions, information otherwise obtained; Applies to all channels and formats (digital, paper, voice, video); Metadata and identifiers included; Includes information in possession of third parties/service providers; Examples of Included Information: Consumer-provided: name, address, phone, email, SSN, date of birth, employment info, income, credit references, tax ID, driver's license, passport info, mother's maiden name; Transaction-based: account numbers, balances, transaction history, payment history, card transaction data, loan terms, fees, interest rates, investment holdings; Service-related: credit scores, fraud scores, financial analysis, risk assessment, customer segments, marketing lists, preference data, service usage patterns; Examples of Excluded Information: Public records (courthouse documents, registered deeds, corporate filings, driver's license publicly available lists); Lawfully published information (directories, news articles, publications); Properly de-identified data (cannot identify individual through reasonable effort); Aggregated data (cannot identify individuals); Information from non-financial contexts (medical records in insurance context may have different treatment); Legal Protections: Protection required under Financial Privacy Rule (Regulation P) - privacy notices, opt-out rights, information sharing restrictions; Protection required under Safeguards Rule (16 CFR 314) - encryption (AES-256 at rest, TLS 1.2+ in transit), multi-factor authentication (MFA), access controls, monitoring, incident response; Breach notification requirements (16 CFR 314.5) if unauthorized acquisition of unencrypted NPI affecting 500+ individuals; Opt-out rights apply to non-affiliated third-party sharing (consumer can direct institution not to share); Affiliate sharing without opt-out permitted (except affiliate marketing opt-out under FCRA); Service provider use restricted to contracted purposes; Redisclosure restrictions - recipients cannot re-disclose NPI; Retention restrictions - keep only as long as necessary for purpose; Data Quality Requirements: Accuracy - NPI must be accurate and current (especially for privacy notices); Completeness - collection limited to necessary information; Timeliness - notice and disclosure timing requirements; Security - safeguards protect confidentiality, integrity, availability; Accountability - institution responsible for NPI protection; Consumer Rights: Right to know - privacy notice describing NPI practices; Right to opt-out - can prevent non-affiliate sharing; Right to access - may request their NPI (varies by state law); Right to correct - may dispute accuracy; Right to deletion - request destruction after relationship ends; Consumer notices and disclosures must be clear, conspicuous, accurate, plain language; Consumer complaints and disputes must be addressed; Identity Protection: If NPI compromised through breach, institution must provide breach notification; Consumer may be offered identity protection services; Credit monitoring may be provided; FTC notification required if 500+ affected; State consumer notification required; Data Minimization: Collect only NPI necessary for stated purpose; Limit access to need-to-know basis; Delete when no longer necessary; Restrict collection of sensitive information (payment card data only when necessary); Special Data Categories: Social Security Numbers (SSN) - highly sensitive, extra protection; Payment card data - subject to PCI DSS if applicable; Health information (if in financial context) - may be subject to HIPAA; Biometric data - increasingly regulated; Location data - privacy concerns; Behavioral data - derived from transactions; Data in Different States: California Consumer Privacy Act (CCPA) - provides consumer rights similar to GLBA; Virginia Consumer Data Protection Act (VCDPA) - additional consumer rights; Colorado, Connecticut, Utah laws - additional protections; Other state privacy laws emerging - may apply to financial institutions; GLBA provides baseline; state laws may provide additional protections; Service Provider Handling: Service providers must implement GLBA-equivalent safeguards; Cannot use NPI except as authorized; Must notify institution of breaches; Must allow institution audits; Must manage sub-contractors; Responsible for data security; Breach Impact on Service Providers: Vendor breach may trigger institution's breach notification obligation; Institution remains responsible for breach notification despite vendor breach; Vendor incident response must be coordinated with institution; Institution must assess vendor's breach investigation; Notification to FTC required by institution (30-day deadline); De-identification and Anonymization: Proper de-identification removes NPI from protection (removes connection to individual); Anonymization if irreversible and properly executed; Safe Harbor standards per HIPAA may apply; Properly aggregated data not subject to GLBA; Publicly available de-identified information not covered; Re-identification risk - if re-identification possible through reasonable effort, still considered NPI"
glba_npi_002,Customer Information,Data Category,"Information collected by financial institutions about customers in ongoing relationships, subject to heightened privacy protections under GLBA Regulation P compared to one-time consumer transactions. Includes broader scope of NPI and extends protections throughout customer relationship.","GLBA distinguishes between consumer and customer for application of privacy protections. Consumer is an individual who obtains or has obtained financial product or service from institution for personal, family, household purposes. Customer is consumer with whom institution has ongoing relationship. Customer information includes all NPI relating to customer and includes information about customer in institution's possession and information about customer in possession of service providers. Customer information relationships are continuous for duration of relationship and may extend beyond relationship for certain purposes. Customer information receives higher protection level under Financial Privacy Rule because ongoing relationship typically involves more detailed financial information. Customer relationships trigger: annual privacy notice requirement (unless FAST Act exemption applies), ongoing opt-out rights for information sharing, annual reminder of opt-out availability, customer access to institution's privacy policy, ongoing data protection obligations. Customer information use restricted to purposes authorized by customer or permitted by GLBA. Sharing limitations apply to customer information - institution cannot share with non-affiliates without customer opt-out right. Service provider relationships with customers require written contracts with GLBA safeguard requirements. Customer information retention policies must document how long information retained and destruction procedures.","All financial institutions with ongoing customer relationships; Applies to individuals (consumers) who establish accounts or relationships; Retail customers (checking, savings, credit cards, mortgages, loans); Commercial customers (business checking, business lending); Institutional customers (large corporations, non-profits, government entities); Investment customers (brokerage accounts, advisory relationships); Insurance customers (policyholders); Loan customers; Deposit account customers; Payment service customers; All customers regardless of account type or product used; Customer information extends to information in institution's records and information in service provider records","Financial institution maintaining customer relationship; Relationship manager or account owner for relationship governance; Privacy Officer for privacy obligations; Chief Information Security Officer for protection; Compliance for adherence monitoring; Service providers managing customer data; Board for relationship governance oversight","Regulation P Sections 1016.3, 1016.4, 1016.5 (Customer and Consumer Definitions); 15 USC 6801; FTC guidance on Customer Information","Active definition","Definition: Individual who obtains/has obtained financial product or service for personal/family/household purposes; Ongoing relationship (not just single transaction); Relationship may be dormant but still customer if account maintained; Customer Information Components: All NPI about customer (application data, transaction history, financial profile); Information in institution's possession; Information in service provider possession; Information created by institution (credit scores, risk analysis, segmentation); Historical information throughout relationship tenure; Information about customer transactions with service providers; Privacy Protection Requirements: Initial privacy notice at account opening describing information practices; Annual renewal notice required (FAST Act exemption available in limited circumstances); Revised notice for material changes in privacy practices; Notice must be clear, conspicuous, accurate, plain language; Notice must explain opt-out rights for information sharing with non-affiliates; Opt-out Rights: Customer may direct institution not to share with non-affiliated third parties; Opt-out right applies throughout customer relationship; Institution must provide reasonable means to opt out (online, phone, mail); Opt-out must be honored within reasonable timeframe; Customer may revoke opt-out at any time; Affiliate marketing opt-out separate right (if applicable); Ongoing Data Protection: Information security program safeguards required; Encryption of customer information; Multi-factor authentication for system access; Vulnerability assessments and penetration testing; Security awareness training for all personnel; Vendor oversight and management; Incident response procedures; Breach notification if customer information compromised; Retention and Destruction: Retention period based on business purpose and legal requirement; After relationship ends, customer information retention limited; Destruction procedures in policies; Secure disposal (physical and digital); Documentation of destruction; Service Provider Agreements: Written contracts required with customer information access; Contracts must require GLBA-equivalent safeguards; NPI use restricted to contracted purposes; Breach notification obligation; Audit rights for institution; Data return/destruction on termination; Sub-vendor management; Redisclosure Restrictions: Customer information received from other institutions cannot be re-disclosed without compliance; Restrictions on re-use of shared information; Third parties cannot use for own purposes; Limitations on frequency of disclosures; Customer Rights: Right to accurate information; Right to know information practices; Right to control sharing with non-affiliates (opt-out); Right to correction/dispute (varies by state); Right to be informed of breach; Right to identity protection services (if breach); Right to complaint/escalation; Marketing Restrictions: Account numbers cannot be used for marketing (except to institution and affiliates); Customer financial information limited use for marketing; Marketing lists must respect opt-out; Marketing communications must be clear; Unsubscribe/preference options required; Access and Correction: Customers may request access to their information; Right to correct inaccurate information (varies by regulation); Right to dispute and document disputes; Some states provide explicit access/correction rights; GLBA provides less explicit access rights than some state laws; Relationship Duration: Customer status continues while account open; Dormant accounts still customer status if maintained; Relationship may be deemed ended after: account closure, termination by institution, customer request, inactivity period (varies); Data protection continues until relationship formally ended; Certain information may be retained after relationship ends for legal/business purposes; Multi-Product Customers: Institution may have multiple relationships with customer (checking, credit card, mortgage); Separate relationships or aggregated customer view; Privacy notices may be combined or separate; Opt-out elections may be combined or separate; Information sharing practices disclosed for each relationship type; Business Customers: Commercial customers receive similar GLBA protections; Customer information protection applies; Privacy notices required; Opt-out rights apply; Some provisions interpreted differently for business customers; GLBA framework applies regardless of customer size or account size; Inactive Customers: May be considered customer if account maintained; Privacy notice obligations may continue; Opt-out rights may continue; Breach notification applies if information compromised; Retention policies define treatment"
glba_npi_003,Payment Card Information (PCI),Data Category,"Payment card account numbers, personal identification numbers (PINs), card validation codes (CVV), and related payment card data requiring protection under both GLBA Safeguards Rule and PCI Data Security Standard (PCI DSS), with specific encryption and handling requirements.","Payment card information (PCI) includes: full account numbers, card expiration dates, card validation codes (CVV/CVC on back, CID on front), cardholder name, PIN, and related authentication data. PCI falls within NPI definition under GLBA requiring Safeguards Rule protection. Additionally, PCI DSS (Payment Card Industry Data Security Standard) established by payment card networks (Visa, MasterCard, Discover, American Express) imposes requirements that often exceed GLBA requirements. GLBA institutions handling payment card data must comply with both GLBA Safeguards Rule AND PCI DSS requirements. GLBA Safeguards Rule requires encryption of payment card data at rest (AES-256) and in transit (TLS 1.2+); multi-factor authentication for access; vulnerability assessments; penetration testing; vendor oversight if card data processed by third parties; breach notification if encrypted data compromised (if encryption defeated). PCI DSS requirements include: cannot store PIN or CVV after transaction; cannot store full account number unencrypted; must encrypt in-transit transmission; must isolate payment processing systems; must log and monitor access; must regularly test security; annual penetration testing required; quarterly vulnerability scanning; level 1 PCI DSS compliance (highest standard) for institutions processing large volumes; assessment and audit requirements; vendor compliance requirements. Conflict resolution: comply with whichever is more stringent requirement on each issue.","Financial institutions processing, storing, or transmitting payment card data; Institutions issuing payment cards; Payment processors and gateways; Banks handling card payments; Credit unions issuing/processing cards; Mortgage lenders with escrow payment cards; Retailers with financial services (credit card providers); Any entity handling card data for customer financial transactions; Extends to service providers handling card data on institution's behalf","Card-issuing institution or payment processor; Payment Operations department; Card Services/Processing team; Information Security for technical controls; Compliance for standards adherence; PCI Compliance Officer or DSS Compliance Manager; Chief Information Security Officer (CISO) for overall program; Qualified Security Assessor (QSA) for annual audits; Payment processors and service providers","GLBA Safeguards Rule 16 CFR Part 314; PCI Data Security Standard (DSS version current 3.2.1+); PCI DSS Level requirements 1-4 based on transaction volume; Payment Card Industry Security Standards Council guidance; Visa, MasterCard, Discover, American Express requirements; Interagency guidance on payment card security","Active requirement","Regulatory Basis: GLBA Safeguards Rule applies to payment card data as NPI; PCI DSS requirements apply based on payment network contracts; Compliance with both frameworks required; PCI DSS more stringent on some requirements; Data Elements: Card Numbers - full account numbers, truncated account numbers (first 6, last 4 digits may be displayed in limited contexts); Card Validation Data - CVV (Visa, Discover), CVC (MasterCard), CID (American Express) must never be stored after authorization; Cardholder Names - must be protected as linked to account number; PINs - must never be stored after transaction; Expiration Dates - must be protected when linked to full account number; Authentication Data - security codes, tokens, encryption keys; Storage Restrictions - full account number cannot be stored unencrypted; CVV cannot be stored after authorization; PIN cannot be stored; Full account number and expiration date cannot be stored together unencrypted; Acceptable truncation: first 6 + last 4 digits (IIN + PAN truncation); Tokenization acceptable: replace card number with token; Encryption Standards: At Rest - AES-256 encryption minimum; Strong key management required; Separate keys for different environments; Key rotation procedures; Secure key storage; In Transit - TLS 1.2 or higher encryption required; SSL/TLS not acceptable (older, weaker); Secure endpoints required; Certificate validation; VPN for non-web connectivity; End-to-End Encryption acceptable; Access Controls: Multi-factor authentication required for administrative access; Role-based access controls; Need-to-know principle; Separation of duties; Least privilege principle; Access logging and monitoring; Regular access reviews; Immediate access termination on employment change; Monitoring and Testing: Annual penetration testing required (external and internal); Quarterly vulnerability scanning minimum; Log analysis and monitoring; Real-time alerting for suspicious access; Continuous vulnerability monitoring; Detection of unauthorized changes; Intrusion detection systems; File integrity monitoring; Card Data Isolation: Separate network segment (PCI segment); Firewall protection; Restricted access; Limited connections to other systems; Network segmentation; Denial of unnecessary connections to cardholder data environment; Vendor Management: Third-party processors must be PCI DSS compliant (Level 1-3 depending on function); Service provider agreements must require PCI DSS compliance; Annual vendor audit required; Vendor attestation of compliance (AOC); Assessment of vendor security controls; Validation of sub-vendor compliance; Merchant Relationships: Merchants must be PCI DSS compliant; Merchant assessments required; Merchant violations may require actions; Merchant PCI compliance verification; Non-compliance enforcement; Incident Response: Breach of payment card data likely to trigger PCI forensic investigation; Card network notification requirements; Mandatory breach investigation; Evidence preservation; Root cause analysis required; PCI considers all card data breaches for notification; Notification to payment networks; Cardholder notification; Credit monitoring offers typical; Regulatory Reporting: FTC notification if NPI/card data breached affecting 500+ individuals; Card network notification within specific timeline; State consumer notification per state law; Payment Card Industry board may conduct investigation; Multiple agencies may get involved; Compliance Verification: Annual internal audit required; Annual external assessment by QSA (Level 1 merchant); Self-assessment questionnaire (SAQ) completion; AOC (Attestation of Compliance) submission; Network scanning by Approved Scanning Vendor (ASV); Compliance certification; Post-breach procedures; Fraud Monitoring: Monitoring for fraudulent transactions; Dispute resolution processes; Cardholder protections; Institution chargeback procedures; Fraud detection systems; Real-time authorization reviews"
